video_id,comment_id,author,text,like_count,published_at
WKQclgvusPo,UgxMkYK79SpJ25a3LCR4AaABAg,@이비니더덕,"저분도 피해자임
일단 데뷔는 80년대 여자 소방차 세또래로 
활동 그이후 베복소속사에 김지수라는 솔로로 
데뷔함 그러다가 악기쪽 실력이 있어서 밴드 여그룹으로 나갈려다가 갑자기 소속사에서 나이속이고 데뷔시킨거라ㅜ 짠합니다 저분도",153,2023-06-16T18:35:37Z
WKQclgvusPo,UgyMkwZi10d2u6BiedB4AaABAg,@맛좋은살구,맞는게 하나도 없네ㅋㅋ 이가이씨 원래 80년대 세또래라는 그룹에 멤버로 활동하다가 해체하고 데뷔 몇번 했는데 다 망하고 솔로가수 활동하기 전에 들어갔던 회사에서 돈 많이주겠다면서 베복으로 데뷔하자고 제안함 이가이씨 본인도 첨엔 거부했는데 부모님 병원비 때문에 울며 겨자먹기 식으로 들어감 그렇게 1기 멤버로 활동하려고 했으나 안무 연습 중에 다쳐서 수술하고 쉬던 도중에 회사에서 2기멤버로 활동하자고 제안해서 쩔수없이 합류함 활동하다가 결국 나이 들킴 근데 회사에선 분명 들켜도 책임지겠다고 해놓고 들키니까 이가이씨한테 전부 떠넘김 그래서 자진탈퇴함 ㅇㅇ 영상 올릴거면 조사 좀 제대로 하세요,3397,2023-06-17T02:41:19Z
WKQclgvusPo,UgwbVOi20c8XePLORWd4AaABAg,@chu2016,"이 유튜버 너무하네요. 
이가이씨가 나이를 속인게 아니고 그때 당시 회사 사장이베비복스에서 리더격으로 고등학생 맴버들에게 연예계 생활에 적응잘시키도록 하는게 목적이였습니다. 그리고 베비복스에 들어가기 싫어하셨는데 회사의계약때문에 반 강제로 들어가게됩니다.이미 세또래 개인앨범등으로 연예계 생활에 잔뼈가 굵었습니다.
그리고 지금은 몸이 많이 안좋으셔서 병원과 집에서 통원치료중입니다.",1064,2023-06-16T08:52:52Z
WKQclgvusPo,Ugwt3NGbZiCcmsdZfCR4AaABAg,@user-dhhdbdjs,"그래도 노래 굉장히 잘하셨음
베복 1집 아쉽게끝나고 컨셉바꾸고 멤버바뀌고 과도기였을때 노래도 좋았지만 이가이님 목소리도 한몫했다고 생각함 꾀꼬리목소리임
그래서 덕분에 자리잡고 이후에 잘된거지",398,2023-06-18T03:10:57Z
WKQclgvusPo,Ugx-XjHdNT5AWadgR254AaABAg,@정혜솜-z9x,사장놈이 속이고 활동하자 하서 한겁니다,1539,2023-06-06T11:04:37Z
WKQclgvusPo,Ugzvh-O_a-F__TeCF9V4AaABAg,@woorikim447,"원래 세또래 라는 그룹멤버로 80년대 후반 활동하다가 90년대 중후반에 갑자기 베복기획하면서 영입된거에요.
퇴출아니고 본인이 힘들어서 나간겁니다.",639,2023-06-09T23:12:04Z
WKQclgvusPo,Ugyj_As6eQghF6Xbqvl4AaABAg,@D-H_Kim,"이가이 까지 말자.
소속사 사장을 까자...",112,2023-06-21T08:13:51Z
WKQclgvusPo,Ugw1EUmdb6rF93wcg294AaABAg,@user-daseul,지금은 유툽에서 없어진거같은데 이가이 이름으로 된 체널 있었는데 그분 지인이 댓글로 언급되는거 싫다고 조용히 지내고 싶다고 댓글 남겼었어서 사탕방인가 사랑방인가 채널 이름 바꿨었는데 이 숏츠가 이래도되나,58,2023-06-13T06:28:29Z
WKQclgvusPo,Ugx8VuDVulBayUiK1Wt4AaABAg,@나야나-y7g,"80년대 아이돌그룹 세또래 멤버였습니다.
제가 그때 세또래 팬이었는데 베이비복스에서 활동할때 진짜놀라긴했어요. 너무나 닮은사람이라고만 생각했었는데 알고보니..",177,2023-06-09T17:15:32Z
WKQclgvusPo,UgxAOVSLD5CwLTXELJt4AaABAg,@puffer4029,이가이는 잘못한게 없다,27,2023-06-25T22:26:54Z
WKQclgvusPo,UgwOFZZzf2am9nR9zkd4AaABAg,@Honey_Jammm,베이비복스 춤자체가 고난이도라 춤영상보면 벅차는게 보임. 컨셉도 걸크러시였으니..,23,2023-06-10T01:35:16Z
WKQclgvusPo,UgyJGEFFCPXzeYsNfY54AaABAg,@보라여우-h8p,속였을까? 대표가 박았겠지,95,2023-06-12T14:00:19Z
WKQclgvusPo,UgycOzdWKvx2ZBbkbix4AaABAg,@김허브-h9b,저사람이 1988년도 세또래로 데뷔한걸로 나옴. 아낙 ㅋㅋㅋ. 1968년생인데 1978년생으로 베복당시엔 활동함,15,2023-06-08T16:03:49Z
WKQclgvusPo,Ugw1FyYmTKBG3sWwFkx4AaABAg,@songlee8922,헐 누가봐도 그 연령으로 보이는데,22,2023-06-12T01:33:06Z
WKQclgvusPo,UgxkzLV6YtkWik_R_2R4AaABAg,@에브리싱랠리,"소속사에서 등초본 분명히 확인했을 건데
소속사에서 속였지 본인이 어케 속일 수 있었겠냐",123,2023-06-08T17:57:18Z
WKQclgvusPo,UgzS-Oy7FW8PcPGnXXd4AaABAg,@996gt-f5ha9lI,"소속사하고 계약할때 개인정보 회사가 알텐데...
회사가 속인거겠지...",7,2023-06-19T16:31:41Z
WKQclgvusPo,UgyaHNlyx4JPieQK9R94AaABAg,@도지-q5o,누가봐도  서른이고만,37,2023-06-13T01:56:07Z
WKQclgvusPo,Ugwyr0ek88fAmvh9RwN4AaABAg,@jypark6032,걸어나오시는 폼이 어깨빵! 당당하고 연륜있어 보임,32,2023-06-12T00:54:04Z
WKQclgvusPo,UgwAiSCr39Pj4knZvMx4AaABAg,@장형임-u8j,"진짜 평생 고통 받으시네
그분...",15,2024-06-28T03:13:37Z
WKQclgvusPo,UgzGU0rvAvq7Lscd4HF4AaABAg,@김지원-m2c,저때부터 저게21살이라고 말도안된다는말이많았지!!😊,2,2026-02-17T22:18:01Z
WKQclgvusPo,UgxFZMFLSBlVC5PBd_p4AaABAg,@뜨허헉,이 채널에서 올린 숏츠들 보면 죄다 뇌피셜인가 싶을정도로 자극적이고 이상함,10,2023-06-22T06:45:02Z
WKQclgvusPo,UgysqUjAnCpkQ2fXr9l4AaABAg,@불방망이-tigers,지금 봐도 이모님이구만,4,2024-06-25T23:15:54Z
WKQclgvusPo,UgyXU8WhFZyxXhVLSSJ4AaABAg,@ripmicky,근데 저분은 본인이 속인게 아니라 회사에서 강요한걸로 암,3,2023-07-05T00:54:57Z
WKQclgvusPo,UgxTg23SJ_yDUBWMD4t4AaABAg,@김민-b4b,세또래 인기많았음 귀여운일본컨셉으로 다들큐티했음,3,2024-05-16T03:56:30Z
WKQclgvusPo,UgyLh-czd1f3vJaIMHh4AaABAg,@달나라-r6k,"예전에 나이 속이고 활동 많이했어요
작으면 많게 많으면 적게..허다한 일이였음",3,2024-06-08T00:22:46Z
WKQclgvusPo,UgypIFeM6hGXfZX-0yJ4AaABAg,@윤정-u1c4m,아니 진짜 21살 이라해도  어찌 뽑힌거야?😢,155,2023-06-08T21:47:00Z
hN0EcQbVmbY,UgyJXhSWSjNsfY7iuXN4AaABAg,@1-k7h,대통령의 시구를 바이든해버린 박민우😂,861,2023-10-07T10:02:03Z
hN0EcQbVmbY,Ugwh3Eo3pwo9-6Vf2C54AaABAg,@개밥-h9q,박민우 추후 검찰조사 받을 예정 ㅋㅋ,2858,2023-04-14T05:26:26Z
hN0EcQbVmbY,UgznUlfMj5M06xEB-sx4AaABAg,@s9_.xm1,와 편집의 힘,42,2025-04-20T12:14:15Z
hN0EcQbVmbY,UgxrQoDKsA0aHa4-3rJ4AaABAg,@어퓨굿맨-n8i,윤석열은 담장안으로,2,2026-06-27T16:53:19Z
hN0EcQbVmbY,UgzwlEm8JEErbf_2lvh4AaABAg,@지나갑시다-x1e,대통령의 시구를 바이든인 박민우,1213,2023-05-18T16:19:36Z
hN0EcQbVmbY,Ugz6JiVReUAJJoCRLb14AaABAg,@우우형제맘부계정,편집 대박ㅋㅋ😂,38,2026-04-03T13:31:05Z
hN0EcQbVmbY,UgxHNj2nF2Z78iER6u94AaABAg,@NC를좋아하는초딩,윤석열의 154킬로 지리누 근데 그걸 또 날린 박민우는 겁나 지리네 그리고 윤석열의 평균 자책점이 0.00,30,2026-01-14T11:40:43Z
hN0EcQbVmbY,UgwLpB_z0WdgrYDM2Cd4AaABAg,@열맀다,보고싶습니다,3,2026-06-25T13:33:30Z
hN0EcQbVmbY,UgzUS7NeP-VqwoPOsiN4AaABAg,@changheonkim7069,ㅋㅋㅋㅋㅋㅋㅋㅋㅋㅋㅋㅋㅋㅋㅋㅋㅋㅋㅋㅋㅋㅋㅋㅋㅋㅋ,6,2025-11-21T01:51:27Z
hN0EcQbVmbY,Ugwqon8invpya9ML-x54AaABAg,@my_mer,전광판에 윤석열 그려져있으면 더 웃길듯ㅋㅋㅋ,784,2023-04-05T09:22:26Z
hN0EcQbVmbY,Ugw9CfAq61unkqfpkfB4AaABAg,@거인운동장,왘 이런 편집예술이다.,204,2023-08-05T08:46:23Z
hN0EcQbVmbY,Ugx-XTIcR8hrEbWCi4F4AaABAg,@정현이-o5b,ㅋㅋㅋㅋㅋㅋㅋㅋㅋㅋㅋㅋㅋㅋㅋㅋㅋㅋ 요즘 안나오는 이유냐고 ㅋㅋㅋㅋㅋ  캡틴 그리워욬😂😂😂😂❤❤,28,2025-09-27T15:41:05Z
hN0EcQbVmbY,UgzJitoegpVV7zJHARF4AaABAg,@호두까까-z6w,너무 마음이 따뜻해지는 영상이네요.,0,2026-06-12T04:46:39Z
hN0EcQbVmbY,UgzPlRiPOVPQ_QbtQQp4AaABAg,@희망한조각,"본능적으로 나간듯 힘도 안들어갔는데 넘기네.,.  근데 참 잘했어요ㅋㅋ",1,2025-12-19T08:30:56Z
hN0EcQbVmbY,Ugx0U9Rh0K3hLCjv7ax4AaABAg,@dlatjdwls5189,NC 본사 압수수색 한다고 합니다.,462,2023-10-02T08:49:16Z
hN0EcQbVmbY,UgxMugz-NuVibsuiPSx4AaABAg,@VintageIbanezowner,154나온게 킬포,240,2023-04-30T12:15:46Z
hN0EcQbVmbY,UgzB9wGPbUI9q7UV3hR4AaABAg,@IVELOVE아이브사랑해,그리고 홈런타구는 마틴이 쳤는데 ㅋㅋㅋㅋ ㅋㅋㅋㅋ,38,2023-04-05T10:09:17Z
hN0EcQbVmbY,UgxsXJ6rYFEZlc2d83V4AaABAg,@권복남-u9w,이범죄자는 왜 자꾸만   나오는겨?,3,2026-05-30T01:15:57Z
hN0EcQbVmbY,UgwtP8EyFeg7B5Yz1RB4AaABAg,@최도령_Nurse,ㅋㅋㅋㅋㅋ😂😂😂캡쳐 잘하셨네 이집 ㅋㅋ,0,2026-06-14T00:33:08Z
hN0EcQbVmbY,UgyNpzKTlnEi23hcKzV4AaABAg,@ductist6448,편집 지리네,0,2026-06-22T00:52:49Z
hN0EcQbVmbY,UgyFFitHjnRirReC8D14AaABAg,@좋은아빠-k2k,ㅋㅋ편집 좋았네요~,147,2023-05-10T03:51:50Z
hN0EcQbVmbY,UgxjJ2uLDKROXudPPat4AaABAg,@Emojiboyisgood,편집 맛있게 하네 ㅋㅋ,75,2025-07-24T11:47:34Z
hN0EcQbVmbY,UgzqtKQoQMjV7vaR-Op4AaABAg,@꼬물로봇,시타자로 어제 과음한 종범이를 내세웠어야징.,15,2025-04-26T06:21:37Z
hN0EcQbVmbY,Ugzu-HZ0gOV1XmprUsZ4AaABAg,@강영민-v8j,편집 지렸다,0,2026-06-10T10:51:24Z
hN0EcQbVmbY,UgyfFJoINMDMgq8a0kh4AaABAg,@김권형-y6i,도리도리 깜방으로 잘 갔구나  !,1,2026-06-27T02:32:26Z
hN0EcQbVmbY,UgxgMc4R8DTJqozdrR94AaABAg,@전설의기타리스트,이거 내란 방지 암살 실패한거 아님??,16,2025-04-20T09:57:48Z
hN0EcQbVmbY,UgyinxP-c9hqOi3yJBB4AaABAg,@Mapoking-no1,역시 날리면,125,2025-07-25T08:53:37Z
hN0EcQbVmbY,UgzUR_7ZeE6NIBGHr5N4AaABAg,@123asdasd54,역대 구속이 제일 빠른 대통령 ㄷㄷ,769,2025-07-11T13:16:35Z
hN0EcQbVmbY,UgzQlDETYSHTSr8XdVt4AaABAg,@통영-b5z,봄날이다.,0,2026-06-24T19:11:02Z
hN0EcQbVmbY,Ugxhv0KoG0dVmYcRHAt4AaABAg,@민규리-j8j,오른쪽으로 바이든~~~,50,2023-05-19T10:57:42Z
PyQ9SJbm_Kc,UgwLyCwYaiUu1RzY0iB4AaABAg,@99boysJP,"사이코패스가
'난 사이코패스 아닌데.. 난 왜 반대로 쓰지?ㅠㅠ '

하고 걱정하는거 본 적 있어요?",5600,2021-11-02T08:23:15Z
PyQ9SJbm_Kc,UgyStWFXAQz0vOJOf0x4AaABAg,@공삼샤,형 싸패야ㅇㅈㄹㅋㅋㅋㅋㅋㅋㅋㅋㅋㅋㅋㅋㅋㅋㅋㅋㅋㅋㅋㅋㅋㅋㅋㅋㅋㅋㅋㅋㅋㅋㅋㅋㅋㅋㅋㅋㅋㅋㅋ,21345,2022-09-22T11:50:52Z
PyQ9SJbm_Kc,UgxssxG4n0AyITu4Rwp4AaABAg,@Y2S-j7i,프로그램은 제작자 수준을 보여줄 수 있다ㅋㅋㅋㅋ,121,2025-04-23T10:19:58Z
PyQ9SJbm_Kc,UgxaIxoMx-QbCkB4zbt4AaABAg,@노경한-k8s,이런걸로 사패를 구분하려는 사람들이 찐 사패같음ㅋㅋㅋㅋ,26669,2022-02-14T00:28:43Z
PyQ9SJbm_Kc,UgwbnoPV018QQUFEEEx4AaABAg,@unknown-zp2nb,자기중심적이라고 무조건 싸이코패스는 아닙니다........ 오늘도 뒷목 잡는 전공자.,3390,2022-02-14T13:36:10Z
PyQ9SJbm_Kc,UgxN_tKlLoAYfZHSRlN4AaABAg,@YASICGEUMJY,"지나가던 싸이코패스 입니다. 실제 싸이코패스는 저 질문의 의도부터 파악하고, 상대방이 보기 편한 방향으로 쓸 확률이 높습니다. 고로, 저런 테스트로는 절대 알 길이 없죠.",20,2025-05-07T04:11:57Z
PyQ9SJbm_Kc,UgzDNtpf017bHxuM17l4AaABAg,@꿀단지-e2k,형 싸패야ㅋㅋㅋ 그리고 나서 본인도 싸패ㅋㅋ,5799,2022-12-12T16:45:18Z
PyQ9SJbm_Kc,UgznfnF5kWDEjhdQM1F4AaABAg,@박지성에서성을빼면지,"억지라고 하시는 분들 계신데 방송 후반부에 이건 게스트들을 낚기 위한 테스트였다는 거 알려주고, 사패랑 아무 관련 없다고합니다~!",1708,2022-02-16T14:01:47Z
PyQ9SJbm_Kc,UgyAP4lJgg9hdqyTHN14AaABAg,@아니-w7e,장성규 진짜 개웃겨 ㅋㅋㅋㅋㅋㅋㅋㅋㅋㅋㅋㅋㅋㅋㅋㅋㅋㅋㅋㅋㅋ,377,2024-05-26T02:25:29Z
PyQ9SJbm_Kc,Ugygi3rh66765cJ7tB94AaABAg,@gsnd3804,걱장할필요가 없는게 자기가 사패라는 의심이 든다면 사패가아님,14566,2021-11-02T04:50:03Z
PyQ9SJbm_Kc,UgzwbSemq6n02aWqcQV4AaABAg,@nannnnnnnne,결과 보고 한번 더 확인하신분들은 사패가 아닙니다.,3912,2022-02-13T15:13:12Z
PyQ9SJbm_Kc,UgyBZyIIfOLH9B4m8Nt4AaABAg,@Y-g1h,장성규 뻔뻔하다 하는거 웨케 웃기냐ㅋㅋㄱㅋㅋㄱㄱㅋㄱㅋㄱㅋㄱㄱㅋㅋㅋㅋ 머가 뻔뻔한데ㅋㅋㅋㄱㅋㄱㄱㅋㅋㅋㅋㅋㅋㅋㅋㅋㅋㅋㅋ,377,2023-12-09T02:31:22Z
PyQ9SJbm_Kc,UgxISvf_juPG3GgXWYd4AaABAg,@동동-y3s,형 싸패야 ㅋㅋㅋㅋㅋㅋ아 진짴ㅋㅋㅋㅋㅋㅋ,2324,2022-02-16T17:02:15Z
PyQ9SJbm_Kc,UgwAMN4fCvNw5wIJ3md4AaABAg,@김민준-n1o,누구 기준으로 E를 써야하는지 궁금했던 내가 레전드,1001,2022-02-15T09:15:22Z
PyQ9SJbm_Kc,UgzWK9ByemvWtl1yuit4AaABAg,@1two34five,E를 그냥 공책에도 방향을 까먹어서 못쓸뻔함,1565,2024-02-13T17:44:13Z
PyQ9SJbm_Kc,UgzAzbure1mWs6kU_CZ4AaABAg,@뤼다-c3d,전에 어디서 본적 있는데 사이코패스뇌를 연구한 연구원이 자기 뇌 찍어보니까 자기 뇌가 사이코패스 뇌였다는 거 본적있는데.. 열 명 중에 두세명이 자기중심적사고를 해도 전부가 사이코패스가 될 리 없고 또 사이코패스 뇌를 가졌다고 해서 다 싸패가 되는것도 아님.  그 박사가 그랫엇음. 고치는게 힘든건 사실이고 아마 숨기고 사는걸거라고. 가정환경이나 뭐 그런 후천적인 영향에 의해서.,1805,2022-09-26T06:07:59Z
PyQ9SJbm_Kc,Ugzzk8lys7zAnutNPZl4AaABAg,@Orbital-111,난 이거랑 공감능력이랑 대체 뭔 상관인지 모르겠다 ㅋㅋㅋㅋ,1082,2022-05-15T14:42:55Z
PyQ9SJbm_Kc,UgwQN70I3SnjAlHBpUB4AaABAg,@freethrow4815,자기 중심적이면 사패? 좋은 예능이군요.,74,2024-03-22T23:53:09Z
PyQ9SJbm_Kc,UgwZlrvy_adrd9uSKR54AaABAg,@woohyeok12321,오른손잡이니깐 그런거 아니냐ㅋㅋㅋㅊㅋㅌㅌㅌㅌㅋㅋㅋㅋㅋㅋ,500,2022-02-18T13:42:12Z
PyQ9SJbm_Kc,UgwBHuWga66ouu2jp294AaABAg,@user-gkwls,지나가다 싸패 된 썰 푼다ㅋㅋㅋㅋㅋㅋㅋ,837,2023-02-15T09:49:58Z
PyQ9SJbm_Kc,UgznsFy_iXhUCs75dTZ4AaABAg,@wptlzk6557,이거 전혀 의미없다고 이미 결과나옴ㅋㅋㅋㅋㅋㅋㅋㅋㅋ,6,2025-06-01T16:44:58Z
PyQ9SJbm_Kc,UgzdP0ir3PM6w_P99D54AaABAg,@joyr4471,마지막 개웃기네 ㅋㅋㅋㅋㅋ 지도똑같이써놓고 보통은 이렇게쓴다고 ㅋㅋㅋㅋㅋㅋㅋㅋㅋㅋㅋ,88,2023-07-09T01:50:43Z
PyQ9SJbm_Kc,Ugy-KBzQMMOx6v5vRkJ4AaABAg,@legendwinger176,공감 못하는 사패치고는 성대모사를 너무 잘하시는 분인데…,46,2022-02-17T02:33:13Z
PyQ9SJbm_Kc,UgyvuGABpCSrO_GDv0Z4AaABAg,@핑구-p4q,19년 인생 갑자기 사이코패스가 됐습니다,5,2025-08-06T14:18:18Z
PyQ9SJbm_Kc,UgyFc-WX9b7QvW6a_xN4AaABAg,@yojunfp,"다른사람 읽기 좋은건 생각 못했구
E쓰기 어려워서 그나마 편하게 쓰는쪽으로....",222,2022-02-14T23:44:35Z
PyQ9SJbm_Kc,UgwOnNiPlaxlxblpDJl4AaABAg,@Selina_k-n1,자기중심적은 나쁜게 아니에요. 이기적이지않고 불법만 안져지르면 되요. 공감능력 많고 정많다고 좋은사람은 아니에요. 한국인들이 정이 많다고 하는데 정아래 편법이 많음,305,2023-05-21T01:26:12Z
PyQ9SJbm_Kc,Ugx0-9VtC8EI8rHSBIV4AaABAg,@마론-e4b,"나 완전 극공감의 아이콘인데
생각없이 그린 E 하나에 싸패라니ㅋㅋㅋ",4,2025-05-09T18:42:18Z
PyQ9SJbm_Kc,UgwcIX6d4FxFd2ZxK4p4AaABAg,@chani0123,듣고 쓰려하자마자 내 시점인가 상대시점인가 고민했다 다 그럴듯,40,2021-11-10T00:56:40Z
PyQ9SJbm_Kc,UgxVFwn1z2dHW1TfR1h4AaABAg,@정림-v6w,핵심은 싸패가 공감능력 및 상대배려마인드가 없다는걸 전달하고 싶은거 아닐까. 자기중심의 최고봉,60,2022-06-19T09:52:01Z
PyQ9SJbm_Kc,UgxCkzFUH64Rgp7O7St4AaABAg,@Mccraw-m4h,"1. 자기 시점
 (1) 아무생각 없이 평소에 그리던대로 E를 본인을
       우선 시 한 방향으로 그림 
 (2) 상대방이 싸이코패스 성향의 유/무를 알 수
       있다는 테스트를 내게 지시하는 만큼
       오히려 싸이코패스의 단어의 색과는 상반되는
       정직함을 중요시 여겨, 상대방이 시킨 대로 할려고
       상대방에게 보여줄려고 하는 생각이 2차적으로
       떠올랐지만, 본인을 우선 시 한 방향으로
       솔직한 선택
2. 상대방 시점
 (1) 약간 눈치를 깜.
       싸이코패스/소시오패스 등 이들의 문제점은
       사회에 악영향을 미치거나 인과관계에 함정이
       되는 지뢰가 될 수 있으므로 본인은 그렇치 않다는
       생각과 융화되어 상대방을 배려한다는 점을
       어필하기 위해 상대방을 우선 시 한 방향으로
       그림.
 (2) 그냥 상대방을 보여줘야 하니까 상대방 우선 시
       하여 그림.

근데 난 이러한 테스트 자체가 정말 싸이코패스 성향이
있다고 하더라도, 이기적이고 무감정적인 결단이
안좋다는걸 이것을 본 싸패들을 [학습] 시키기 위한
용도인 것 같음.

내가 싸패여도, 인간이 어떠한 감정을 가지고 있고
사회생활에서 어떠한 사고를 가지고 있는지를
학교, 유튜브, 지인의 속마음을 터는 등
여러 경로를 통해 ""학습"" 할 수 있기에
이러한 간단한 테스트는 겁주기 용이고
결국 뇌의 반응을 제대로된 기계를 통해
공감능력에 직결된 일반화된 반응검사를 통해야만
분별이 가능한데, 전 국민을/전 세계사람들을
다 분별하기도 어렵고, 오히려 싸패가 더 쓸모 있을 수 도 있기에, 이런 식으로 [길들이는] 것 같음",17,2025-02-23T11:05:50Z
JEXi0nGkEjI,UgzPYweG7UM-GXCxK_t4AaABAg,@여우괴담,"이후의 이야기가 궁금하시다면? https://youtu.be/f4vzj1o9U2A

 매일 오후 2시엔 여우괴담 쇼츠가 업로드 됩니다! 주변 친구들에게 여우괴담의 영상을 공유해주세요.
여러분들의 구독, 좋아요와 댓글은 구미호들을 행복하게 합니다 🦊 💜",1692,2023-08-19T01:18:13Z
JEXi0nGkEjI,Ugz9aEd8UO8hEr2w8fR4AaABAg,@바부_큐앙,"저 가둔사람 ㄹㅇ 고소해야함,,",364,2024-11-30T02:49:14Z
JEXi0nGkEjI,Ugwpu48IAWnP1zQ5E5B4AaABAg,@royean12,개사료 들고 웃는거 보면 웃는게 아니라 점점 미쳐가고있는거임..평범한 사람을 좀 미치게 만들지말라고..,919,2024-02-13T13:26:17Z
JEXi0nGkEjI,UgzPcsbh2J24KqDp1GB4AaABAg,@reflect249,이게 일본 예능의 문제점을 제일 단적으로 보여준 거라고 봄 사람 취급을 안함,644,2023-08-31T16:05:54Z
JEXi0nGkEjI,UgwoyBM44PMEn6uxGdF4AaABAg,@stayc_swith,미친거아닌가 고소안당했나 프로그램 관계자 다 징역살아야겠는데 인간적으로도 말이 안 되고,40,2025-05-12T07:45:27Z
JEXi0nGkEjI,UgxDK0-hWoAX14-HYNF4AaABAg,@박고운샘,"이건 코미디 프로그램이고 뭐고
사람의 목숨 및 심리를 앛아가는
살인입니다",645,2023-08-30T14:39:42Z
JEXi0nGkEjI,UgzUKF3XBVWysWpp_2Z4AaABAg,@희귀닉먹기실패했다,마지막 내용:결국 해방이 되지만 옷이 벗어진 상태로 해방이 됨.그 장소는 몇 백명이 보고있던 콘서트장 그 이후로 주인공은 우울증과 사람과 말을 못 했다고 함,784,2023-08-25T11:48:49Z
JEXi0nGkEjI,UgwzzkAwbUIxP7LugoB4AaABAg,@지나가던나그네슘,일본 예능의 문제임.. 너무 자극적임 몰카라던가 저 영상의 아저씨는 마지막에 엄청난 수치심을 받고 트라우마도 나음,697,2023-08-19T19:16:13Z
JEXi0nGkEjI,UgwIsmbUf_Bfd6qSp1t4AaABAg,@KanekiKen07_20,"저건 좀 아닌데..,?  사람 취급도 안하나 진짜 어느나라든 제작진들 지들 이익만 생각 하고 출연하는 사람은 개만도 못한 취급하네 우리나라 제작진은 자극적인 설정으로 나오는 사람들 연기 시켜서 괜히 욕 오질라게 먹게 하고 우리나라에서 신뢰 가는 제작진이라면 이야기 다루는 예능 아니면 나혼산이나 전참시 이런것만 신뢰감.",32,2024-08-12T13:52:00Z
JEXi0nGkEjI,UgyI7IesRGkGvhS12fp4AaABAg,@티모시-p6p,저거 엔딩이 현실판 트루먼쇼라 걍 인권유린...저게 실화라는게 충격이었지,53,2024-11-13T05:17:02Z
JEXi0nGkEjI,UgwHchNFaMrIpxHpUQV4AaABAg,@milk_0325-n4h,이건 선 넘었다..  그리고개사료 들고웃는거보면 정신이 이상해진거임..,15,2025-01-23T01:01:54Z
JEXi0nGkEjI,UgxJpF-FNlzBCRJLnA54AaABAg,@키키-k9y,저거 웃는게 아니라 점점 미쳐 가고 있는 거예요 저러다가 정신 장애인 될 수도 있어요,31,2024-09-02T14:46:01Z
JEXi0nGkEjI,UgzeI91yatrDyrNvRy54AaABAg,@kmw4156,마루타의 후예들 아니랄까봐 사람갖고 실험하는건 ㄹㅇ개좋아하네,13,2025-05-09T06:05:06Z
JEXi0nGkEjI,Ugz6niCeL5-U_s_gAdZ4AaABAg,@구독-e8c,아니 강아지 사료를 들었는데.. 갑자기 소름 이야 ;; 무섭게 웃고 있어 ㅠㅠ,112,2023-08-27T04:41:42Z
JEXi0nGkEjI,UgxeKs1_nVAeWL3wrgN4AaABAg,@앙기모띠드버거,현실판 트루먼쇼,34,2023-08-26T13:27:32Z
JEXi0nGkEjI,Ugx42AElJGv5Sv2nZmR4AaABAg,@user_high_shool_student1,트루먼쇼 영화 리뷰인가? 했다가 들어오자마자 정색하고 봤네요..,15,2023-08-25T13:16:02Z
JEXi0nGkEjI,UgzQwhrq9wLUMf9yCHh4AaABAg,@펭에에귄,주인공불상해ㅠㅠㅠㅠㅠㅠㅠ,103,2023-08-19T02:35:10Z
JEXi0nGkEjI,Ugz1eFql1NRng_26zSh4AaABAg,@테디베어-p3u,저거 봤는데 진짜 멘붕됨..ㄷㄷ 마지막이 ㄹㅈㄷ,187,2023-08-18T23:10:58Z
JEXi0nGkEjI,Ugzcxqqz2yszTGJoLDV4AaABAg,@kelihon,그런데 웃긴건 저분 한국에도 오셨는데 그 비행기티켓을 처음에 왕복권을 경품통해서 가격채워야 한다해놓고 너무 빨리 끝나니까 편도권 2개로 슬쩍 조건 변경하는 졸렬한 모습도 보여줌,2,2025-09-18T09:56:18Z
JEXi0nGkEjI,UgxuYPgamKEgIyerPp94AaABAg,@kkang8282,이건..범죄아니냐고...사람을 죽이는거와 마찬가지잖아.,6,2024-06-10T10:12:19Z
JEXi0nGkEjI,UgzZVOUEP56_1QGv_wJ4AaABAg,@전두환-f5f,"???:이번미션은 개사료를요리하기입니다
???:음 개사료가이븐하게 익지않았어요 탈락입니다",2,2024-11-26T13:12:24Z
JEXi0nGkEjI,UgzKHpauP_EWm8o2xV54AaABAg,@또치소방본부,김동현폼미쳤다,8,2023-09-03T14:16:04Z
JEXi0nGkEjI,Ugx_icu8yiE3TjLNiup4AaABAg,@sunny801130able,제작진 나쁜넘 나스비 불쌍,9,2023-08-18T23:25:20Z
JEXi0nGkEjI,UgzCa1_y8ztakK3IMFB4AaABAg,@블류듀드,드닐레이브 갔고싶다…,8,2023-09-10T10:31:45Z
JEXi0nGkEjI,Ugx5yQaTXfMjHxizzzl4AaABAg,@슈브니,주인공이 너무 불쌍하네요 마지막에 주인공 표정 보면 진짜 정싱 나가있는거 처럼 보이는데...불쌍하네 여우,2,2023-08-19T07:02:39Z
JEXi0nGkEjI,Ugy2uSC8tbJaPpSFmph4AaABAg,@빡희,"어떻게 사람이 사람을 미치게 할수 있을까.......
어떻게 사람이 사람을 살인을 할수 있을까.........",4,2024-07-08T08:59:33Z
JEXi0nGkEjI,Ugx4hhWmmY9cT4KP0QZ4AaABAg,@ch_0524,이제 링크가 막혀서 할수가 없다고 한다...,10,2023-09-12T10:40:46Z
JEXi0nGkEjI,Ugy1wleql42NGaN-VBp4AaABAg,@Sequanis,너무 끔찍해 진짜 개밥 보낸 사람 누구냐우,5,2023-08-24T18:28:14Z
JEXi0nGkEjI,UgxOUkGC0DvUUMiji1V4AaABAg,@TRUE-qiwuuw,당발 룰렛 인가요?,5,2023-10-06T02:48:31Z
JEXi0nGkEjI,UgyPGhILWoE1eXIGpXh4AaABAg,@thsdnd,김동현이 저런 역경을 겪고 UFC에 진출했다니 응원합니다,3,2025-02-02T08:53:22Z
WlATVFj3VYY,UgwCw-KdC3goDJ5lVEp4AaABAg,@특별한이야기,"🔊충격적인 메시지가 담긴 KPOP👇🏻
https://youtube.com/shorts/2LEluOTBe88",289,2023-06-04T04:10:31Z
WlATVFj3VYY,Ugza-Ysir0QLWbJiIuB4AaABAg,@SiYeonKimChi,25이면 진짜 아이돌로 마지막 기회였을거라.... 얼마나 좌절했을지 너무 안타까움,4581,2023-07-18T05:03:57Z
WlATVFj3VYY,UgzBzi3SLWE9lOQHTeB4AaABAg,@yaku6295,그래서 어릴때 부모품 떠나서 학교도 제대로 안보내고 숙소생활 시키는거 안좋다고 생각함.. 연예인이 아니더라도 삶이 있다는걸 알게해줘야하는데 너무 시야를 좁혀버려서.,3254,2023-10-25T16:07:05Z
WlATVFj3VYY,UgwKFCOVT6_cFa-cUJh4AaABAg,@_doubleL,더 안타까운게.. 생각보다 실력도 엄청 좋았음ㅠㅠ 성격도 착해서 리더했으면 그룹 잘 이끌어나갔을꺼 같았는데 나머지 애들에 비해 나이 많다는 이유로 탈락함😢,4559,2023-06-21T21:14:07Z
WlATVFj3VYY,Ugz2vBoMtG8vkcTh07h4AaABAg,@블루블루86,부모가 연예활동 하는것에 대해 탐탁치 않게 여긴대다 금전적인것도 일절 지원해주지 않아 알바해가며 독하게 연습생 생활 버텼는데 나이가 많다고  퇴출되고 엄청 힘들어하다 결국은 극단적인 선택했다 들었음..아이돌이 아니더라도 솔로가수나 배우로도 전향시켰으면 끼가 있는 친구라 날개펴고 훨훨 날았을텐데 소속사 잘못 만나서 날개가 꺾인 가여운 친구임,351,2024-04-04T16:33:09Z
WlATVFj3VYY,UgwC5-LByzvQKCDtksN4AaABAg,@Yetyetyap,저 분 나이가 그때 25살이었나 ㅠ 연습생 계약기간동안 오랜기간 묶여있으면서 데뷔조로 희망고문이란 고문은 다 해놓고 막상 마지막에 떨구고  그래놓고 나중가서 나이가 너무 많아서 퇴출시키니 당연하게 희망이 없다 생각 들었겠죠 목숨다바쳐 열심히하고 이게 아니면 다른일은 없다 라고 생각한 사람한테 저정도면 사형선고 아닐까요,2692,2023-06-16T12:10:51Z
WlATVFj3VYY,UgzKKmbXQlmEO79wVjN4AaABAg,@bluefighterj,데뷔조 들었다고 다 데뷔 하는게 아니더라구요. 얼마든지 교체 아니면 방출.... 연예인도 천운이여,583,2023-08-01T07:00:41Z
