video_id,comment_id,author,text,like_count,published_at
xZaNpLpJAGA,Ugye6a4EhHgonVCqRjB4AaABAg,@user-jordan23bulls,악플러에겐 관심이라는 음식을 줄 필요없이 무시하고 조용하게 고소하자,23,2024-04-07T06:27:40Z
xZaNpLpJAGA,Ugzo03PH88VRKuIOxzR4AaABAg,@은빛-s6q,쌍커풀 두꺼워서 메이크업 지우면 저정도 두께 나오는거 맞긴함,147,2024-04-14T13:18:29Z
xZaNpLpJAGA,UgzQH4cFO3R_2YY8x4B4AaABAg,@아이뜨끄림,ㅠㅠㅠ장원영한테 도대체 뭐느 생각으로 저런건지ㅠ❤,47,2024-04-12T23:16:47Z
xZaNpLpJAGA,Ugyh31wwKzH1cpIxQtt4AaABAg,@suesue-d5v,"장원영은 유독 애들이 더 난리를 치는 것같음. 예쁜데 착하기까지 하니까. 질투땜에  난리치는데..장원영은 멘탈도, 마음도 단단한 것 같더라. 말하는 것만 봐도 ..이런 딸이 있으면 너무 좋을 것 같다.",10,2025-05-02T13:40:04Z
xZaNpLpJAGA,Ugz3A8FjsXB5563pMiN4AaABAg,@날꼬셔봐,와… 너무했다 근데 생얼도 역시 넘 카와이❤❤,19,2024-05-02T23:52:25Z
xZaNpLpJAGA,UgwWhcRQR34P80bDiV54AaABAg,@eunha_mouse08,원래 인기가 많으면 사랑과 존경을 많이 받는 만큼 미움도 받게 됩니다😢,11,2024-04-17T08:27:09Z
xZaNpLpJAGA,UgxwXJsj-YSxAgR4vN94AaABAg,@SY-qp2bn,심지어 눈 코 입 한거 같은데,15,2026-05-10T16:23:59Z
xZaNpLpJAGA,UgyRJQt0ngtLWI7bjkl4AaABAg,@이은미-j8c,사람이 아닌듯 정말 이쁘네,106,2024-04-01T09:04:53Z
xZaNpLpJAGA,UgxdBQ7Dsf5f-ic-IFZ4AaABAg,@suyeon_j13,근데 원영님 완전 어른스러운데 아직 만 19세라니 진짜 대단하다😮,12,2024-05-17T23:59:01Z
xZaNpLpJAGA,Ugx70PQ_TbPvZ_-Q94R4AaABAg,@정-q2o2g,근데 쌍커풀 너무 진하게 해서 눈화장 한게 확실히 밸런스가 맞음 안한건 쌍커풀이 좀 부자연스러워 보이더라…,40,2024-04-13T13:12:12Z
xZaNpLpJAGA,UgwikDZchKtBTqiQIaJ4AaABAg,@inhim05,포샵 꺼지 해서 억까라니 ㄷ ㄷ,54,2024-03-28T03:22:00Z
xZaNpLpJAGA,UgzzshHyjmN5Pv_6MJp4AaABAg,@jwjwjwiwiiw,악의로 한 사진 왜 김한주닮았냐ㅋㅋ,7,2024-05-05T13:04:48Z
xZaNpLpJAGA,Ugx-gKEgilDR-tT3wAZ4AaABAg,@EW-lm2ef,저거는 김한주잖아 ㅋㅋㅋㅋㅋㅋ,7,2024-05-10T11:21:17Z
xZaNpLpJAGA,UgyzihU2omBwyGm2Arx4AaABAg,@seo-15th,"익의적으로  포토샵 한 것도 예뻐보이는데. . . . .?
무튼 장원영 진짜 너무 이쁘당❤",7,2025-05-20T10:31:17Z
xZaNpLpJAGA,UgxTIpYkWiMt_97CUXN4AaABAg,@치즈-18,장원영 내 최애 역시 너무 예쁘당❤,10,2024-04-12T12:23:36Z
xZaNpLpJAGA,UgzSlphrIvfxZmiO8wh4AaABAg,@kimsh-m3p,어라 한주형 왜거기서나와;;,8,2024-04-18T13:35:15Z
xZaNpLpJAGA,Ugx30I81r1OgxmWKhpt4AaABAg,@gatto1004,"장원영이 19세란 나이가 너무 좋음, 아직도 젊고 예쁜 장원영을 볼 시간이 많이 남았다는거.",4,2025-03-26T15:44:40Z
XQfZheFvmYg,UgwLUVwkLjtREcmDfz54AaABAg,@joeslin,아니 애초부터 팔로워 96만이면 원래 걍 유명인이었네;;;;,14888,2023-06-04T10:15:40Z
XQfZheFvmYg,UgzS5I0mIDVAak_RiM54AaABAg,@냥이-r8l,디즈니는 이사람을 인어공주로 뽑았어야 했다,22143,2023-06-04T12:55:41Z
XQfZheFvmYg,UgxRqH2WMkuLIPdqWSp4AaABAg,@Woopa_,디즈니는 인어공주를 드라이브 스루에 박아났네 그러니 ㅈ 망하지,6665,2023-06-04T04:44:06Z
XQfZheFvmYg,UgwH8zqAlw0K2x0SEvF4AaABAg,@제우스Mind,한국 코디랑 화장하니까 오히려 마이너스됨....,8,2026-02-02T14:08:17Z
XQfZheFvmYg,Ugy2OjBwo9gAJcd_Sst4AaABAg,@꿍치-w6j,"진짜 저게 ㄹㅇ 개성있고 매력 터지는게, 서구적인 그 특유의 이목구비는 유지하되 미적으로 호감가는 요소도 적절히 갖춘 이상적인 아름다움임..",37,2025-03-11T02:08:29Z
XQfZheFvmYg,UgwaXpsG9NbTRqtGpc54AaABAg,@뿌링-h1x,저 영상 분위기가 넘 사랑스러움..,4929,2023-07-03T07:52:58Z
XQfZheFvmYg,UgyjU-JXqohQOCPHa5p4AaABAg,@내바깥양반과결혼해줘,이 분 라푼젤 실사화 주인공으로 나오면 좋겠네요,11530,2023-06-06T12:15:14Z
XQfZheFvmYg,Ugz78yPXr78LqA8Cv0N4AaABAg,@surger7267,보기만해도 기분 좋아지게하는 신기한 능력이 있네,6791,2023-06-06T13:35:26Z
XQfZheFvmYg,UgwjDipy6-NCLrGzNQh4AaABAg,@huynsungyang1151,표정이 진짜 풍부함… 얼굴이 호감형인데 표정까지 풍부하니 이뻐보임,443,2023-06-19T04:24:43Z
XQfZheFvmYg,UgxscplJEuR0VSUunp94AaABAg,@고기맛사탕-y3i,진짜 디즈니공주같아서 신기함 ㅋㅋ 예쁘고 에너지도 넘치고,2783,2023-07-04T14:47:22Z
XQfZheFvmYg,UgxCbvL633mXApebGJB4AaABAg,@아임리치맨,배우하기 좋은 얼굴인거 같다 웃을때와 표정 지을때 여러 각도에서 봤을때 각각의 다른느낌이 보이네,514,2023-06-05T14:06:30Z
XQfZheFvmYg,Ugz9slb9VgaU8xpVLaJ4AaABAg,@내이름유자-vei1,정말 예뻐서 끌리는게 아닌 표정과 말투에서 에너지가 느껴져서 끌림,2408,2023-06-06T20:31:38Z
XQfZheFvmYg,UgzCmHRgTdGCVld69yJ4AaABAg,@BLUE-iv8xy,라푼젤을 인간화ai돌리면 저 얼굴이 나올것 같음,286,2023-06-04T04:05:21Z
XQfZheFvmYg,UgyDGuTG2EPbD8daXv54AaABAg,@dawnstar_8,그냥 너무 예쁘다 힐링되는 얼굴,448,2023-07-01T15:48:45Z
XQfZheFvmYg,Ugy5Di4zbjpUJnpoGz94AaABAg,@доктор.тигр,"연예인 화장하니까
겁나 평범해져 버렸다
어디서나 굴러다니는 흔해터진 연예인 됨",3,2026-01-06T03:33:51Z
XQfZheFvmYg,UgxxWTi7KBezrrkyMgB4AaABAg,@레오나르도,졸라 예쁜데 3년이나 ㄷㄷ 성실성도 갖췄네,953,2023-06-05T11:43:35Z
XQfZheFvmYg,UgwF_X-L57Wiky4YaZl4AaABAg,@死번타자호성,표정이나 몸짓 이런게 모두 물밖 세상에 호기심 가득하던 에리얼 표정을 잘 표현함 ㅋㅋㅋㅋㅋ 으디 이상한 연기 못하는 애 흑인티오로 데려온것보다 훨씬,583,2023-06-06T01:07:09Z
XQfZheFvmYg,UgxzRutNTNLUXwWtSpN4AaABAg,@user-uf4mq4bm3r,미모가 ㄹㅇ 한국 사람들이 좋아할만한 미모의 서양인 스타일이네,242,2023-06-04T02:31:48Z
XQfZheFvmYg,Ugx9wo_9RlK3MU0dCfV4AaABAg,@김현-d5x,진짜 전형적인 미국 얼굴ㅋㅋ,22,2025-04-08T23:03:49Z
XQfZheFvmYg,UgyUmpWLHBTt9HaxmY94AaABAg,@월남댁-t4c,주근깨보이는게 더 좋은데,24,2023-06-04T06:52:20Z
XQfZheFvmYg,Ugyj9zaYQxy2jEaTQop4AaABAg,@hanbyeolup,눈 코 입 배치도 미첫는데 다른 부가적인 요소들 까지 조화가 ㅠㅠ 주근깨가 너무 사랑스럽..  너무 아름답다,865,2023-06-07T11:03:52Z
XQfZheFvmYg,Ugy9bGJb59ti3nA1shJ4AaABAg,@덤벨-d6n,힐링 그자체다....,987,2023-06-07T13:40:54Z
XQfZheFvmYg,UgyYt42YZHo_H5VRLZZ4AaABAg,@다마고치즈,"예쁘기도 예쁜데 뭔가 매력적이게 예쁨...
디즈니 영화 찍어주셨으면",19,2023-06-23T14:30:19Z
XQfZheFvmYg,UgypdooIZ6gUsQ4ba6h4AaABAg,@Riley_Reid,외국여성분들 표독스러움이 1도 없어서 좋음,4,2024-02-25T02:06:59Z
XQfZheFvmYg,Ugz9rs4zpihw_JoQM6h4AaABAg,@냥푸치노9471,근데 뒤지게 예쁘긴함,34,2023-06-05T15:42:15Z
XQfZheFvmYg,UgzOf-7RyEyd6MjqmxJ4AaABAg,@안티티티티프라쟈,와 근데 진짜 말이 안나온다 너무 이쁘다 ㄹㅇ;; 진짜,1008,2023-06-07T12:53:50Z
XQfZheFvmYg,UgztjyvlMVgh2JojO1Z4AaABAg,@달달허니-q4x,관리 안받고 저정도면 진짜 관리 제대로 받으면 어마어마 할 듯..,23,2023-06-06T14:26:48Z
XQfZheFvmYg,UgzhrTLtgw0ztejprSB4AaABAg,@user-fd4nq7kn3n,근데 왜 카페알바할때가 젤 이뻐보이냐,105,2023-11-05T08:53:04Z
XQfZheFvmYg,UgyziLkgIvWXTH3qFUd4AaABAg,@Mehi-o4y,이분 원래부터 유명한 인플루언서였는데 무슨ㅋㅋㅋㅋㅋ 저것도 다 컨셉영상임,8,2024-10-04T12:58:18Z
XQfZheFvmYg,UgyLLRc5rvJXojVvMS54AaABAg,@제플린White.Summer,"예쁘고, 잘생기면 행복의 절반을 가진거다 ㄹㅇ",898,2023-06-08T13:44:17Z
tN_y9teWgqU,UgyricDP8TjVWZD3NLV4AaABAg,@hungry_white,도대체 몇명을 여자로 만드는거냐,400,2025-01-15T06:06:04Z
tN_y9teWgqU,UgwDoWR5yxZnd_tvBbh4AaABAg,@BAKAyuppi,주인장은 하루빨리 히토미 끄고 자전거타면서 바람좀 쐬러 밖으로 나가십쇼...,1350,2024-11-30T13:35:38Z
tN_y9teWgqU,Ugy_szuhKjK0jgCk-WB4AaABAg,@장미-y1d6k,이건 남녀노소 다 무서워요 ㅋㅋㅋㅋㅋㅋㅋㅋ,12234,2023-09-10T06:06:30Z
tN_y9teWgqU,UgwJgGs4YEpEN2_PjOx4AaABAg,@MADCULTURE00,도대체 평소에 뭔 생각을 하면 제목이 저따구냐,4352,2024-09-27T16:28:15Z
tN_y9teWgqU,UgyqFwb8Q5_fkF-_XKh4AaABAg,@artrefchannel6347,무슨뜻으로 쓴 제목일까 하고 댓글 확인하러 들어왔는데 나만 그런게 아니었네,2149,2023-12-22T17:52:26Z
tN_y9teWgqU,Ugxo6yNZVFuM3wOUCbV4AaABAg,@Doran_Sword,이건 남녀노소 환장하고 도망갈거같은데,118,2023-12-18T09:25:37Z
tN_y9teWgqU,UgxXHctZWvMM3Mge39p4AaABAg,@light_light_blue,이건 사람이면 다 무서운 거잖아...,1712,2023-11-24T14:27:15Z
tN_y9teWgqU,UgwU1Gl43PYW5Dt2tC54AaABAg,@이름뭐하지_1234owo,도대체 무슨생각을 하길래 제목이 저따구인거지,117,2025-02-06T11:25:48Z
tN_y9teWgqU,UgxxJdQ3TEyHqu9oFrl4AaABAg,@삔또남,33살 남자인데 오늘은 부모님이랑 같이 자야겠네요,279,2023-11-04T20:14:05Z
tN_y9teWgqU,UgzoH5vGF-owaIkiKwt4AaABAg,@fgdhkic,감사합니다 덕분에 여자라는 사실을 알게 됬습니다,1977,2023-12-08T07:39:07Z
tN_y9teWgqU,UgwmdLXjupJuwzFpl0p4AaABAg,@I_Go_Nan1,히토미꺼라 주인장게이야..,1496,2024-03-16T14:32:28Z
tN_y9teWgqU,UgxZpis9RWzHep-J1-F4AaABAg,@RI-v3s,요즘 새로운 유튜버들은 왜이러냐....,1595,2024-01-19T00:11:07Z
tN_y9teWgqU,UgxKtQJslX9gNt-Hg3V4AaABAg,@kk.kk.,남자인데 보다가 랄부가 떨렸습니다. 감사합니다.,532,2023-12-09T14:10:07Z
tN_y9teWgqU,Ugzn8UK6sSqvTg_0bk94AaABAg,@user-rainbowangel,남자가봐도 무섭고 할머니 할아버지 이모 고모 삼촌이 봐도 무섭다,10,2024-12-28T08:21:13Z
tN_y9teWgqU,Ugy7ARx_0VIh2xz3b1B4AaABAg,@82728jdk,썸네일 보고 껍질 벗긴 꼼장어 인줄,9,2024-03-18T12:58:53Z
tN_y9teWgqU,Ugx7gExwRHATw2Eayl14AaABAg,@BEWAROP,남자가 봐도 징그러운데 제목에 여자만 언급한건 다른 의도가 있는거 아님?,827,2023-12-10T09:24:22Z
tN_y9teWgqU,UgzXzViZJdnniXHAVP94AaABAg,@sonysakaend,마지막에 똥소리때문에 깜짝놀랐다 ㅋㅋㅋㅋㅋㅋ,618,2023-02-06T06:18:46Z
tN_y9teWgqU,UgwJJG7UNTK92YYShqt4AaABAg,@다다-m4y,제목 버스에서 유튜브야설보는 할배가 지은듯,6,2024-07-13T03:19:42Z
tN_y9teWgqU,Ugz3tJhWxVj9kbVJHQl4AaABAg,@jaeyoung._.,영화에 나올법한 외계인 같아서 소름임,209,2023-08-30T02:53:43Z
tN_y9teWgqU,Ugx6y-2Ypz-ASX1zYmx4AaABAg,@brillante15,많은 게임에서 저런형태의 몬스터를 본거같음…. 뭔가 친숙하다,5,2025-03-22T07:20:04Z
tN_y9teWgqU,Ugza_ecgq0fXXMKRPqp4AaABAg,@정영훈-b8n,남자가 봐도 무섭고 징그러운데요,447,2023-07-25T15:44:56Z
tN_y9teWgqU,Ugw45CNhfng7H-f6I5t4AaABAg,@그러네요,"저 벌레 전문용어로 ""낚시 미끼"" 아녔나 ㅋㅋㅋㅋㅋㅋㅋ",3,2024-11-07T02:46:19Z
tN_y9teWgqU,Ugw8hxeZpt8hWVTDGCh4AaABAg,@kanjangstwe,저 혈충의 이빨은 캐라틴 성분인데 우리의 손톱 성분입니다,241,2023-07-27T21:34:24Z
tN_y9teWgqU,UgzduOPID1SLGZZfSAd4AaABAg,@자덕야덕,제목이랑 뭔 상관이냐,15,2023-12-25T12:50:02Z
tN_y9teWgqU,Ugz4qU6dfv5HUk-Ol8B4AaABAg,@카푸땅,이 징그러운 생명체보다 제목의 뜻이 더 궁금;;,1006,2023-08-31T01:42:02Z
tN_y9teWgqU,UgyicmKIsoWVOLFVU1x4AaABAg,@001_Alpha,승질머리 못 부리게 라이터로 지지고 싶어요 아님 뜨거운 기름으로 ㅋㅋㅋㅋ,13,2023-12-13T19:46:04Z
tN_y9teWgqU,UgzL7ZCrQhNNP1H-q5J4AaABAg,@aa4178,킹콩에 나온 벌레가 이거였네,71,2023-08-02T05:24:35Z
tN_y9teWgqU,UgxM80Mxc1yT9oNyy4h4AaABAg,@C_최제우스,저게 그 킹콩에 나왔던 괴물이였구나,4,2025-04-26T10:57:53Z
tN_y9teWgqU,UgwWtvKvmC6Lf5sCaWZ4AaABAg,@윤준구-y8m,2005년 킹콩 영화에서 주인공 일행이 킹콩 때문에 덜어진 절벽에서 나온 괴물이랑 꼭같다,9,2023-09-05T14:35:00Z
tN_y9teWgqU,UgzxsWLGPaTvEsiqujR4AaABAg,@레티비아,주인장은 정신좀 차려라,1,2025-09-15T14:32:29Z
fHKv2JY4bps,UgztOgsjRhWexrRnxyR4AaABAg,@이쁜보라색강아지,조지게이야..,36464,2023-01-08T15:51:54Z
fHKv2JY4bps,UgxZx51cbzcbFddC-7l4AaABAg,@user-abcdefu,불법채취 해놓고 나중에 동상 하나 띡 세워놓으면 그만이냐고 ㅋㅋㅋ,37234,2023-01-13T18:27:50Z
fHKv2JY4bps,UgxVV0EuB9eBauQxcZx4AaABAg,@ko2265,제일 불쌍한게 집이 너무 가난해서 아들이 고아원에 갔는데 그 고아원에서 아동폭행을 당하다 사망했음ㅠ,6189,2023-01-17T07:46:13Z
fHKv2JY4bps,UgzDLpMKY8rY4wkQQ5B4AaABAg,@쿠쿨칸-q1o,추가로 유전적 특징인가 싶어서 가족들에게 거짓된 말을하며 남은 가족들 조직검사도 했었고 헬라세포 발표해서 상까지 받았던가 했었죠,3110,2023-04-03T14:18:32Z
fHKv2JY4bps,UgzIP6RExNy8Zsqbr-p4AaABAg,@bh1746,미국 의료계에 이렇게 섬뜩하고 잔인한 역사가 꽤 있음... 그나마 요즘에는 의대에서 그런역사를 잘 가르켜서 다행이지만...,17824,2023-01-12T15:32:54Z
fHKv2JY4bps,UgxcuEqA71wkl1VNHoR4AaABAg,@asdfghjkl-js4ti,진짜 짜증남. 유가족에게 보상도 제대로 안하고,6018,2023-01-15T13:00:09Z
fHKv2JY4bps,Ugzb9yYbxo7k1pzi4wV4AaABAg,@lugy1337,저 동상 세운 것도 ㅈㄴ 어이가 없네... 바라지도 않았던 일인데 뭘 기린다는 거야,110,2024-01-22T11:35:30Z
fHKv2JY4bps,UgyLv_SOul1QYgb7lWh4AaABAg,@피콘-y8e,헬라세포가 암세포라 분열할 때마다 변이를 자주 일으켜서 지금은 다양한 변형본이 있다고 합니다. 변형이 덜 되어 처음 형태와 차이가 적은 헬라세포는 매우 비싸기 때문에 일반 연구기관에서는 일정 수준 이상 변이된 헬라세포들을 취급합니다.,6468,2023-01-13T02:34:36Z
fHKv2JY4bps,UgxdtOgyKQZuU914__54AaABAg,@하노이이장,1950년 그당시 관심을 가진다는건  지금 많은 이들이 생명 연장 운을 가졌구나 감사한 일이구나,84,2023-09-08T18:01:34Z
fHKv2JY4bps,Ugybtl_vR9EnEBzqWXN4AaABAg,@jyhong29,"헬리세포는 많은 암치료 연구에 공헌했죠. 안타깝지만 미국 특허법이 사람의 세포는 보호 범위가 아니라서 재산법의 보호를 못 받습니다. 그리고 치료과정에서 ""버려진 재산""으로 취급되서 보상받기도 힘들고요. 주에따라 환자의 동의를 받아야하는 곳도 있습니다.",4240,2023-01-14T15:43:16Z
fHKv2JY4bps,UgyJcdbOaUrA6va0U2d4AaABAg,@호이-q2e,무섭다 진짜..그녀의 부분은 영원히 살아있네,4068,2023-01-11T20:49:48Z
fHKv2JY4bps,UgypKuYMaSQB9zeoMWF4AaABAg,@정지영-j0y,"폐기되야 할 암세포를 허락 없이 가져가는건 문제가 없다고 봄
저 가족들도 별로 상관없었겠지
하지만 보상은 해줬어야지;
희생해서 과학계에 큰 발전을 이루게 해줬는데
로얄티는 왜 안줘",104,2025-04-13T07:37:34Z
fHKv2JY4bps,UgwK2bNvVOGcpR7w-BB4AaABAg,@Ninanoeuu,와.. 진짜 너무 한거 아닌교... 슬프다 ㅠㅠ,7847,2023-01-08T09:30:28Z
fHKv2JY4bps,UgxwqWmzQNzRj3umLOF4AaABAg,@jennalee7073,"헨리에타, 대학 입학하자마자 억지로 읽어야했던 두꺼운 책...저 세포는 현재도 증식해서 엄청나게 많다고 하고 저 사실이 알려진 것도 어떤 사람이 이 세포의 출처가 어디일까 궁금해하며 밝혀진 것이라고하죠. 가족들은 그때 그 사람이 말해주기 전까지 몰랐다고하고 증식하는 신기한 세포를 쓴 사람들도 궁금해하지 않고 썼다는것도 참..",703,2023-01-15T16:21:44Z
fHKv2JY4bps,Ugw2wB6CsqPHYWTvn954AaABAg,@놀라는선응이_부계,리버스 데드풀,9,2024-04-14T07:36:38Z
fHKv2JY4bps,UgxzSZmA2BL3KIuLEiJ4AaABAg,@2yteyt325,현재 헬라세포는 인간의 염색체와 다른갯수를 갖는 돌연변이가 나와서 이 세포들을 인간의 세포로 가정해야할지 고민중이다.,956,2023-01-15T12:15:33Z
fHKv2JY4bps,UgyX-ry2gS5TjfxjKt94AaABAg,@mooo2765,암세포가 저렇게 강력하고 끈질긴줄 몰랐네.,513,2023-02-19T15:11:08Z
fHKv2JY4bps,UgwHei5UOK9KFTLL3yx4AaABAg,@LEE-qv9bj,저분은 피해를 받은게 아니하 사람을 구한겁니다,18,2024-01-06T20:13:51Z
fHKv2JY4bps,UgxpHx09rXBsWr-QZoJ4AaABAg,@seo_se_o,"이분에 대한 'the immortal life of henrietta lacks' 라는 책을 읽으면 가족들과 함께 진상을 파헤친 잉야기가 나옵니다.
헨리에타라는 분이 그 당시 존스홉킨스 병원에가서 치료를 받게되고, 존스홉킨스 연구실에서 힐라 세포를 복제하게 된것인데, 그 당시에 존스홉킨스 병원은 흑인에게 무상치료를 했기때문에, 그들은 가족 동의없이 저 세포를 무단으로 복제한것을 자신들의 권리라고 여겼다고 합니다. 
더 끔찍한것은 저분 세포가 자가복제 한다는건 헨리에타가 살아있을때 알았습니다. 즉, 의료진은 헨리에타에게 본인의 의사를 물어볼 수  있었던 겁니다. 딸분이 그런말을 해요 만약 엄마한테 당신의 세포가 세상을 구할 수 있을거라고 의료진들이 헨리에타에게 말했다면 헨리에타는 기분 좋게 기꺼이 응했을거라고
저분이 돌아가신 후에 남편분이 시체 검안을 거부했는데, 가족력에 의한 암인지 검안한다고 속인 후, (참고로 남편분은 헨리에타의 사촌이었습니다) 저분의 몸에서 세포조직을 체집했고, 그때 체집한 세포들이 지금까지도 복제된 힐라 세포입니다.
여기서 그치지 않고, 존스홉킨스 병원은 가족들에게 암검사라고 거짓을 한 후, 여러번 헨리에타의 자녀들의 dna를 체취해 힐라 세포와 비교하면서 힐라 세포가 제대로 됐는지도 확인했다고 하고요, 힐라 세포는 실험목적으로 우주에도 나갔다오고, 원자폭탄 실험할때도 쓰이고 했다고 합니다 물론 가족들은 나중에 알았고요..
저분의 가족들은 지금까지도 가난하게 아무런 의료 혜택 혹은 보상을 받지 못했다고 합니다. 저 책을 쓸때 가장 많이 참여한 deborah, 헨리에타의 딸은 2009년에 뇌졸증으로 돌아가시는데, 아마 엄마 일과 더불어 자신이 알지 못한 여자 형제가 있었고, 이미 오래전 정신병원에 맡겨진 후에 그곳에서 맞아 죽었다는 일 또한 알게된 후 불안장애를 앓으셨는데 그게 원인일거라는 말도 본 적이 있네요",500,2023-01-29T03:55:23Z
fHKv2JY4bps,UgxZxlgBhoUsOqsWkYJ4AaABAg,@hoo8208,Hela cell 굉장히 유명한 암세포. 생명과학을 다루는 모든 실험실에서 갖고 있는 세포,35,2023-01-16T23:32:20Z
fHKv2JY4bps,UgwNHhiFeALSWn4uFXp4AaABAg,@seonkim4098,앜 싱크 너무 좋아요. 방해돼 —> 요 부분이 조금 더 애기가 하는 억양이면 더 좋을것 같아요.,11,2023-03-24T02:26:19Z
fHKv2JY4bps,UgzTcTH2uUBgU9RI8pF4AaABAg,@user-ob4gu1zu4e,진짜 생명관련 과면 무조건 배우는 헬라세포ㅜㅜ,571,2023-01-18T04:21:32Z
fHKv2JY4bps,Ugy7CFreDxqIi93sGAR4AaABAg,@맞춤법빌런-u6g,"솔직히 말해서 내가 의사였더라도 체외에서 분열할수있는 세포는 진짜 못참을 것 같다

+그래!!!! 미안해!!! 내가 같다갔다 구분 ㅈ도 못하는 ㅂ신이라서 미안해!!!! ㅇㅋ 알겠어!!! 갔다 아니고 같다라고? 알겟어!!!! 이해했어!!!! 내가 마음 깊이 미안하다!!!!

+ 깊.이
ㄱㅣㅍㅇㅣ
gip eeeeee",842,2023-01-14T00:04:30Z
fHKv2JY4bps,UgzsuQbYnltqoMyB37p4AaABAg,@Yujin_KIM-o1q,지나가려다 채널명 보고 좋아요 누름 ㅋㅋㅋ,2,2024-11-20T12:59:43Z
fHKv2JY4bps,Ugxdq61GwKzmo0r8Qbd4AaABAg,@EskEscSwc3570,지금은 본인이 동의해야 기증자 조직에서 세포 분리가 가능합니다. 예로 산모 탯줄에서 분리하는 HUVEC이 있죠. 대학원생 시절 탯줄 나온다고 교수님께 연락 받으면 만사 제치고 식염수 튜브 아이스에 꽂아 산부인과 병동으로 달려갔던 게 생각나네요.,251,2023-01-19T10:01:28Z
fHKv2JY4bps,Ugx1jWRgkcJ58PHMnHZ4AaABAg,@마리모-r9u,근데 어떻게 저 세포만 체외에서 안 죽고 계속 분열하는거지?? 신기하다,60,2023-01-30T18:57:14Z
fHKv2JY4bps,UgxO4NwuYCqCPG8AHqd4AaABAg,@JSD662,불법채취와 적절한 보상이 없다는건 매우 큰문제지만 저 세포의 가치는 정말 어마무시한것같던데.. 만약 가족들이 반대했다면 그것대로 큰 손해가아니였을까 싶긴하네,5,2023-04-05T02:42:13Z
fHKv2JY4bps,UgzFTxaw9ANU7rAROvF4AaABAg,@HOOTHOO522,게이 박사님 그렇게 궁금하셨어도 허락은 받으셨어야죠ㅠㅠ,121,2023-01-08T18:21:18Z
fHKv2JY4bps,Ugz6ZHHSnrBW0OC97BJ4AaABAg,@RIRA00,어떻게 영구적으로 분열할수있는거지? 분열을 하려면 영양분이나 에너지를 얻어야 할텐데 무엇으로부터 얻어서 분열할수있나?,69,2023-02-07T04:26:53Z
fHKv2JY4bps,Ugy7G2-4pIbhWgjWPTl4AaABAg,@롬크,헨리에타 렉스를 받아준 병원은 당시 흑인을 받아주는 얼마없는 병원이였다,5,2023-05-31T10:08:30Z
wuzBP7e1c50,UgwntxSfy3yBGvBFIS54AaABAg,@류승현-p9p,😊,0,2026-02-08T00:12:18Z
wuzBP7e1c50,UgybiZPlrJWX9pOD7Ct4AaABAg,@촌신-o1c,광명 철거전후 빌라 5억에서 7억짜리 4년후 입주임박해서 18억....,1,2026-02-07T09:45:20Z
wuzBP7e1c50,UgzaAcbj2iHkzA8ZL094AaABAg,@albert-rl5rg,"광명뉴타운 11구역.. 조합장 문제 등등으로   사업이 너무 느려졌고  평당 공사 가격이 현재로는 아주 저렴한 상태임. 현장  땅다지기 하는 상황에서 아마도  추가 분담금 협상중?? 경험상  할것 같음. 입주권(조합원)을 산 사람은 피눈물 흘릴수 있음.  평당 600??에서 1000만원 되면 ?? 11구역 생각하는 분들 조심들 하길.. 11-2구역  조심 하길~~ 위치,교통, 경사도 는 뉴타운중에서 가장 안좋음..분양가 너무 비쌈.. 임장 가면 절대 안사는곳??임..",1,2026-02-07T13:41:32Z
xIP9UkV8TY4,Ugw_Km-AgDRJDHqcLEd4AaABAg,@JMi-f5c,데뷔안하는 이유: 실제 저런얼굴인줄 알고 캐스팅하러 갔다가 바로 실물보고 런했기때문임 ㅋㅋ,14333,2025-07-30T10:59:03Z
xIP9UkV8TY4,Ugxkaj7RiZCwSjZCHRF4AaABAg,@dvdxc-o5m,애초에 옐언니는 보정빡쎄게해서 인플루언서 짓하는 애들이랑 결이 다르지않나,13776,2025-07-30T14:15:41Z
xIP9UkV8TY4,Ugzy1IOnto1BwHhs5qt4AaABAg,@Ddddddddddleee,요미센은 보정을 아예안하는듯 다른 곳에서 나온 영상들이랑 아예 똑같음 실물이 더 이쁠테니까 찬양하자,3990,2025-07-30T15:55:43Z
xIP9UkV8TY4,UgyyLGDNjXwCdR-QbpB4AaABAg,@김덕배-kjh,요미센은 볼때마다 ㅈㄴ이쁘다 생각했는데 실물도 레전드 존예네 ㅋㅋ,5277,2025-07-30T14:57:20Z
xIP9UkV8TY4,UgwyfFuppfrQaDVxvut4AaABAg,@윤이계인,인스타 보정이 자기얼굴인줄아는 모자라는 애들이 많음,3835,2025-07-30T08:14:27Z
xIP9UkV8TY4,Ugx6Enfs8AWTh8Tcak14AaABAg,@dice-xn3yk,요미센이 진짜네 ㅋㅋㅋ 조명이랑 각도만 맞추면 끝나는 얼굴임 뭐 안건든듯,487,2025-07-30T20:09:00Z
xIP9UkV8TY4,Ugxj2R5KUWx45_j3H_p4AaABAg,@seo-t2p,저정도 인물은 학교마다 최소 30명 이상일 듯. 그냥 계속 숨어 사는게  낫겠다,999,2025-07-30T10:14:15Z
xIP9UkV8TY4,UgwV-d8oicHEDSSPWjx4AaABAg,@눈오리-f8d,데뷔 안 하는 이유 : 왜겠냐,583,2025-07-30T08:32:17Z
xIP9UkV8TY4,UgxFpMiSdmHTLxWqTVN4AaABAg,@형유-g1j,몇명은 괜찮은데 일카후면에서 저정도면 실물보면 비슷함,614,2025-07-30T14:22:45Z
xIP9UkV8TY4,UgzBhEYudQX9sTtEQMB4AaABAg,@user-yc9qe8fe1s,세은은 진짜 예쁘긴 함,730,2025-07-30T10:22:01Z
xIP9UkV8TY4,Ugw5IqRdBoAaOc-TVQx4AaABAg,@user-lt5hy7zk7z,일반인 대상 탈덕수용소 ㅋㅋㅋㅋㅋ 다를게뭐냐,21,2025-08-01T12:22:48Z
xIP9UkV8TY4,UgwFb_guCxP5mm6n1QF4AaABAg,@뭘보노-280,"보정한거가지곤 ㅈ도 뭐라 안함
다만 보정해놓고 그게 본인 원래 얼굴인것마냥 말하거나 행동하고 다니니까 까는거임",76,2025-07-30T17:24:07Z
xIP9UkV8TY4,UgyGfyRgHb1TV8MncfB4AaABAg,@user-z5f4l,요미센은 릴스랑 똑같은데,302,2025-07-30T08:00:18Z
xIP9UkV8TY4,Ugx7Tf7bNaWoDgJwG4l4AaABAg,@숭이-0215,아니 근데 옐언니는 조명때문에 좀 부해보이는거지 원래도 개인 유툽 많이 올리고 원래도 이쁘신데,22,2025-07-30T16:56:26Z
xIP9UkV8TY4,UgyRl8wVRLskGeRH3RF4AaABAg,@파무-y4m,눈을감자 저분은 비율이 ㄹㅈㄷ네,4,2025-08-03T17:27:29Z
xIP9UkV8TY4,UgygDpG9QTJGaHUCtkt4AaABAg,@성이름-q7e2o,옐언니는 예쁜걸로 바이럴 된 그런 느낌은 아니라 괜찮지 않을까요.. 굳이 막 엄청 보정을 하시는 것 같지도 않던데,96,2025-07-30T14:21:01Z
xIP9UkV8TY4,UgyAXwM3xWtSjW-TSC54AaABAg,@hawkman8596,정말로 연예인급 외모라면 연예인을 했겠지.,13,2025-07-31T02:19:44Z
xIP9UkV8TY4,UgyGVfRFUE8uhVqADFl4AaABAg,@user-uv3ge7oe9l,세은은 진짜 해도 되겠는데,56,2025-07-30T13:09:35Z
xIP9UkV8TY4,UgxLCHiMaUDVQvdzygV4AaABAg,@은은-f5d,정서현은 누가 데뷔하라고 난리친거임?ㅋㅋㅋㅋㅋㅋㅋㅋㅋㅋㅋㅋㅋㅋ,41,2025-08-03T17:00:47Z
xIP9UkV8TY4,UgzXd9Ew95jMZq1GwR14AaABAg,@뀨-f9m3c,인스타랑 틱톡은 남의 사진 올리는곳임?,39,2025-07-30T09:18:46Z
xIP9UkV8TY4,Ugx2eeuBfMrVwfWNMHB4AaABAg,@하늘바다땅-n4x,은하는 저정도면 이쁘네,193,2025-07-30T10:22:22Z
xIP9UkV8TY4,UgxNKNZojUMXCvawAYB4AaABAg,@user-jn1xs1dh6j,"요미센, 은하는 진짜인데? 똑같음",2,2025-08-04T14:44:11Z
xIP9UkV8TY4,UgyaaUKoNmxsSRtznBd4AaABAg,@qwer_09mm,뉸을감자인가 저 사람은 비율 장난아니네,3,2025-07-30T17:11:31Z
xIP9UkV8TY4,UgyLmLnhmIQI6SU4vOp4AaABAg,@XD-qe6vl,또다른매력이라고 커버 이빠이 쳐쥬는 주인장에게 박수를,3,2025-07-30T16:48:52Z
xIP9UkV8TY4,Ugzds4I-D13p1ekP0I94AaABAg,@박혁거세-l5f,까불이는 아예 다른사람인데,4,2025-08-01T12:49:14Z
