video_id,comment_id,author,text,like_count,published_at
tfbai6qIlB8,Ugwq7GArHKWHsZdD4XR4AaABAg,@어거스트-q3l,"외국 발레리나들이 무게가 많이 나가서
발레리노들이 은퇴가 빠르다고 들었어용
부상없이 오래 오래 볼수 있기를 바랍니다
넘 멋져요",127,2025-04-15T02:22:56Z
tfbai6qIlB8,UgwimQvyvtEtJEl8Hdh4AaABAg,@rena_camping,요정 한쌍이 춤을 추는듯하네요❤,62,2025-04-12T09:23:00Z
tfbai6qIlB8,UgyJWt-QhbGAZRh5-CR4AaABAg,@허브35,와~~어떻게 몸이 저렇게 휘어지지ᆢ정말 요정 같다❤❤👍👍👍👍👍,39,2025-04-16T10:43:56Z
tfbai6qIlB8,UgwheyPxFW1ZEA2bjyh4AaABAg,@Nabi_socute,거의 서커스 수준 안무...,26,2025-05-01T01:22:25Z
tfbai6qIlB8,UgzL_dcOfe_KVxxMjSZ4AaABAg,@stillippuni,"넘 아름답다 
마치 한 몸인듯 만들어내는 춤의 선들이 고혹적이고 설레게 한다",31,2025-04-16T00:44:30Z
tfbai6qIlB8,Ugw3YoMZaiBcLh-dYUp4AaABAg,@zeze-j-8,손이랑 발이랑 인사시켜주깈ㅋㅋㅋㅋ,42,2025-04-12T07:27:36Z
tfbai6qIlB8,UgwXEHk7t9GyddcizIF4AaABAg,@백억벼리,"아이고 허리야
보는 내허리가 다 아픈데
너무 우아하고 아름다움😊",15,2025-05-02T07:25:41Z
tfbai6qIlB8,Ugx7Lozt3_92WfK2p6d4AaABAg,@mimijay3735,두분이 그림체가 비슷해요❤,42,2025-04-11T21:07:52Z
tfbai6qIlB8,UgwDgRVljmO_kkc2AWh4AaABAg,@The-life-of-stray-cat,정민철은 혼자출때 더 멋지구나,6,2025-05-01T04:31:20Z
tfbai6qIlB8,UgzH2nuWbnHXqed-1x14AaABAg,@zxcvbnm-gg1hj,우와~~너무 아름다워요,19,2025-04-14T14:55:09Z
tfbai6qIlB8,Ugyt0YShevs5qeRWokF4AaABAg,@so_youn85,"난 인어공주가 왕자어게 반하는거 이해안갔는데
민철 왕자님 보니 내가 인어라도 왕자에게 반해서 
육지로 나가고 싶었을듯  ㅇㅇ",4,2025-05-29T04:27:18Z
tfbai6qIlB8,UgwPMh6RNxd9TuJHjzx4AaABAg,@WeedinGreenhouse,ㅇㅏ니 리프트 난이도 뭐예요?? 어쩜 저렇게 얇은데 리프트도 잘해… 리나 코어도 대박이네요,9,2025-04-25T11:53:44Z
tfbai6qIlB8,UgyoQPd7RH9bbVDjmRd4AaABAg,@rond3435,"발레리노는 허리건강.
하체 근력 두배는 키워야겠네요",2,2025-05-06T05:08:25Z
tfbai6qIlB8,UgxpkN9MwgEqj05RI2h4AaABAg,@Jullian-x8k,종이접듯 발레리나를 막 접어버리네요😂😂😂,0,2026-01-02T10:20:01Z
tfbai6qIlB8,UgxLl6izUEQcfGjqH6R4AaABAg,@YoungsooStellaKim9001,안무가 아름답네요,3,2025-05-10T02:33:27Z
tfbai6qIlB8,Ugygp0zGl3Xh00veHyd4AaABAg,@박정희-u1f,발레리나의 코어 힘이 엄청나네요.  두 분 연기가 아름답습니다~~~~,11,2025-04-19T09:55:05Z
tfbai6qIlB8,UgxYCoO7tChG2MGiSuJ4AaABAg,@물푸레-c8j,우리나라  발레수준도  꽤나 높은가봐요,9,2025-04-15T01:47:14Z
tfbai6qIlB8,Ugze_zXDhQOM_NpJ25p4AaABAg,@wonariachung1852,🧚‍♂️🧜‍♀️❤,5,2025-04-11T12:31:52Z
tfbai6qIlB8,UgzkziAvkB4LIKi3KfB4AaABAg,@박혜경-v6c,"아니 발레에 왜 서커스를 하시나요? 
너무 잘하네요.",13,2025-04-12T05:20:17Z
tfbai6qIlB8,UgxTsBKu0jth-x7DIFt4AaABAg,@메로나사랑,어지간한 발레리나 아니면 전민철한테 기죽어 못하겠네요,1,2025-07-07T08:11:03Z
tfbai6qIlB8,Ugw2f3_IuxHYybvG2PJ4AaABAg,@여누-k,미쳤.. 다... 아름다워~~♡♡,2,2025-04-29T14:29:03Z
tfbai6qIlB8,UgyLeoSEwFpgmAbeaxR4AaABAg,@jakobpalljohannsson,🙏🏻❤️🌿 🇮🇸,3,2025-04-11T09:48:43Z
tfbai6qIlB8,UgzN8GmFpZ1ysmPV3eR4AaABAg,@ruthu213,명화 같습니다.!,4,2025-04-30T00:56:52Z
tfbai6qIlB8,Ugw2H5gTfucfBEik3Ex4AaABAg,@Yung142,❤❤❤❤❤❤❤,1,2025-04-17T05:37:06Z
tfbai6qIlB8,UgyYsMhiHde3gguwVcR4AaABAg,@rosa-zf5hn,와 우,2,2025-04-28T04:53:06Z
tfbai6qIlB8,UgyCstzUJPUnARiBb6F4AaABAg,@yang4bal2,발레리나님 코어 뭔데요...?😮,6,2025-04-20T13:46:47Z
tfbai6qIlB8,UgxLWkU-NaCoVFBj3jV4AaABAg,@현채빈-f3j,엄청 힘들겠네요,1,2025-04-29T06:01:43Z
tfbai6qIlB8,UgyOiDTgt24SjDELN2l4AaABAg,@뷰티풀-h6r,2% 부조~~~~옥 해보이는 느낌   화면먼 보면,5,2025-04-12T01:54:15Z
tfbai6qIlB8,UgxnEf3LzxPpTIZnqZZ4AaABAg,@rachely.3712,😅아름답지만... 민철군 힘들겠다는 생각도 드는 이모팬심 🤦🤭 ㅎㅎㅎㅎ,1,2025-04-27T05:29:10Z
5OsC9XpVGO8,Ugwg8xYsDzDeHmSuiUl4AaABAg,@sotong-kh2zl,남자는 여자보다 더 힘들듯. 여자무용수를들어야되고 돌리고 심지어 저렇게 공중에 띄우기까지 해야하는구나. 아름답고 힘찬 민철발레리노!  응원합니다. 세계로 뻗어나가세요! !,15,2026-06-27T07:46:22Z
5OsC9XpVGO8,UgysuoG6KmVLWX1HtP94AaABAg,@문옥순-j8t,"던졌다가 받기가 힘들텐데   밥 많이 먹어야겠네. 
전민철 화이팅!!!!
부상멊이 끝까지 화려하게.",12,2026-06-27T07:00:14Z
5OsC9XpVGO8,UgyhpkZYvH95UfpbDMJ4AaABAg,@2_be_true,민철리노 부디 부상 조심해주세요🙏,4,2026-06-27T16:06:26Z
5OsC9XpVGO8,UgxwkTL5ypamQoCoP814AaABAg,@irinaablaeva6909,"Это, наверное, Ромео и Джульетта!!!",2,2026-06-28T16:11:55Z
5OsC9XpVGO8,UgwClEJo2qgvn2JsmQF4AaABAg,@emmarose5894,아우 관절......;;;;;;,5,2026-06-28T00:52:52Z
WHLTMKvdx-o,UgxwnCKNfa3I_JuiO5l4AaABAg,@박선희-p3h,"갈아넣은 혼에 비해 턱없이 적은겁니다
춥고 배고파 그만둔 사람들 수두룩...",452,2025-12-30T11:26:31Z
WHLTMKvdx-o,UgzC6S6_0NN-M7OruXZ4AaABAg,@루비-u1u,"무용이 제일 돈이 많이드는예술중의하나임
레슨비.작품비.음악비.의상비.메이크업.마사지.병원비.식단조절.머리끝에서 발끝까지 신체적 정신적으로  .몸이 무기인 종합예술",152,2026-01-06T11:19:59Z
WHLTMKvdx-o,Ugy_yhFo9NXyW1pGi4h4AaABAg,@리심플-v3n,"뭣모르고 옆집 친구따라 시작했다가 드레스비에 메이크업.. 안무비 등등
초딩때 대회 몇번 나간걸로 우리집 휘청휘청했음 다행히 선생님이 전공할만한 몸매라거나 재능은 없다해서 우리집 살아남ㅋㅋㅋ",47,2026-01-05T11:40:44Z
WHLTMKvdx-o,Ugz1DCfHuqQ2AFEj2MR4AaABAg,@user-rw7li7ok6i,"얘네들이 국립발레단 등에 남아있는 이유는 돈보다는 명예 때문임. 무용을 하는 얘네들 집안이 돈이 많음. 무용복, 슈즈, 안무비, 대회출전비 등등 돈없으면 못함.",30,2026-02-25T14:31:50Z
WHLTMKvdx-o,Ugxq-Oqd9Q9pGSHhF0d4AaABAg,@jeongeunkim5502,"국립발레단 들어간건 레슨을 위한 이력이고요, 돈은 레슨으로 버는 겁니다.
  이건 성악이나 악기도 마찬가지에요.",23,2026-02-23T16:06:44Z
WHLTMKvdx-o,UgyGBXLxZ0Rsbx10FBN4AaABAg,@여전히아름다운지-r7l,재능충이어도 돈이 없으면 할 수 없는 발레,105,2025-12-27T01:00:44Z
WHLTMKvdx-o,UgzLzk-qWfDmn8qSdiB4AaABAg,@신나게살자-i1l,얘들아 발레단원들 레슨비  얼만지 아니?그것도 시간당...상상을 초월한다,764,2025-11-01T13:05:01Z
WHLTMKvdx-o,UgyZkbxFCOc-j_gIQZZ4AaABAg,@rena_camping,발레 배우는 집들은 우선 부자임,496,2025-12-23T05:18:29Z
WHLTMKvdx-o,UgzHXbyYPPLNGQ7Y_sR4AaABAg,@Do_ra_0509,"결국 발레단 들어가도 틈틈히 강사로 일해야되요
집이 부유해서 걱정없이 무용에만 전념하는 분들이 많죠",354,2025-08-30T15:21:47Z
WHLTMKvdx-o,UgzuM71XUW1JU9GT1Yd4AaABAg,@22503,"의미없음 이미 부자들만 우리나라에서 발레리나로 키울 수 있음, 진짜 재능충아니면…. 다들 원래 부자임",195,2025-12-12T03:18:31Z
WHLTMKvdx-o,UgxXzbk3pERUl6mhXQ54AaABAg,@롤리랄라호룰루,"원래 순수예술이 인풋에 비해 아웃품이 없음,,, 특히 무용은 음악이나 미술보다 시장이 작아서 더 돈 안 될거임;
나는 순수도 아닌 디자인 전공자인데 주변에 서국홍 나온 사람들 다 자기 월급에 현타 많이 받음ㅋㅋㅋㅋㅋ 디자인이 이정돈데 순수 예술은 자기 밥벌이만 해도 대단한거지",65,2025-12-22T04:05:16Z
WHLTMKvdx-o,UgyPP-mmkRpmsWMvxyB4AaABAg,@Channel-od2mr,발레강습으로 발레 배우고 나중엔 다시 발레강사로 일해서 돈 벌게 되는...그들만의 창조경제랄까...너무 길이 좁음,60,2025-12-31T01:05:16Z
WHLTMKvdx-o,Ugzf_N_8blKO0Ape3U94AaABAg,@김푸름-d5u,"개개인 강습비로 꽤나 벌거임
학생들 레슨비가 주수입일거임
시립,국립 발레단이런건 명패고",235,2025-10-27T06:17:13Z
WHLTMKvdx-o,UgwCPU80ZtjrJ4YaymJ4AaABAg,@박선희-i1u9u,배우는데 투자비용에비해 넘 돈이 안되는것 같은데.  흠-,38,2025-12-26T14:25:17Z
WHLTMKvdx-o,UgzoOV4xTWZ11xDGIBx4AaABAg,@이혜선-q2h,원래 예체능 대체로 빛좋은개살구여유🤭,59,2023-11-05T06:33:23Z
WHLTMKvdx-o,Ugzuek0WZrwKTGTfkbZ4AaABAg,@pinker-gh1hv,"애초에 돈 많이 벌려고 무용수 안하겠죠 
그니까 순수 예술은 있는 집 자식이 하는거란 
인식이 있음
투자는 계속 해야하는데 수익성은 떨어져서ㅠ
그래서 무용 그만 둘때까지 지원해줄수있는 
후원자가 있거나 집안이 근본 빵빵하거나 
아님 댓글에 적힌대로 틈틈히 학생들 
가르치러 나가거나 찐으로 좋아하는거 아니면
지속 못할 직업 같음",19,2026-01-07T00:42:32Z
WHLTMKvdx-o,UgwHb3C5GVCm9w7VcvV4AaABAg,@SSSh-f7e,우리나란 예술쪽 페이가 너무 짬…인정도 잘 안 해주다가 외국에서 주목 받으면 그때서야 부랴부랴 모셔가려고 호들갑 떨고…돈이 있든 없든 살아남기도 너무 힘들고.,18,2026-01-25T09:00:29Z
WHLTMKvdx-o,Ugw0C1rMdUR2R7UOX-B4AaABAg,@Esne12z,국내는 박봉인 편인데 해외는 보통 정단원 7천선이 보통임..해외 메이저급 수석은 몇억선이고 그 나라 유명 패션브랜드가 할인에 수석만 무대의상협찬들어감,33,2025-10-27T23:11:42Z
WHLTMKvdx-o,Ugw7WoYN9tXN_25IsXN4AaABAg,@이름이름-t1n,한인출신 하버드대법대교수인 여자가 자신이 거기까지 닿을 수 있었던건 오랜시간 발레에서 배운 극기때문이었다고 인터뷰함,21,2026-01-02T10:02:25Z
WHLTMKvdx-o,Ugx2ZrKKlWrPFrHU5uh4AaABAg,@sookseo1802,콩쿨 의상이 제일 싼게 130만원이라 하는거 듣고 입이 떡 벌어짐 그거 계속 입을수도 없다함,15,2026-01-15T03:04:15Z
WHLTMKvdx-o,UgwbvoFgZWhkqw1B5j14AaABAg,@jsejun,"박명수가 딸을 왜 무용 시켰겠나
애초에 돈이 없으면 진입 못하고
어느정도 재산 돼서 시작해도
그 안에서 스승 이바지 등으로
현질경쟁하는데 현질에서 지지않을
자신이 있으니까 무용시킨거
딸을 국립이건 시립이건 발레단
들어갈 때까지 후원했다는 자체가
우리가 걱정할 집안이 아니라는 이야기",76,2025-12-25T12:57:21Z
WHLTMKvdx-o,UgxZMn8Yf7lDd-Is_Vl4AaABAg,@smileesther9866,"10년 넘게 공들여서 레슨과 교육을 받은 시간과, 에너지, 노력과 정성에 비해선 턱없이 낮은 연봉이에요! 게다가 발레는 무형문화재, 인간문화재라는 국보개념이 없다는 사실도 발레무용예술가에게는 매우 안타깝고 아쉬운 처우입니다.",10,2026-01-11T12:22:44Z
WHLTMKvdx-o,UgxTZacZrvGEzvO0lod4AaABAg,@mice73jp,"캐나다 국립 발레단 부속 학교 근처에서 자주 있었는데, 저녁이면 차들이 애들 픽업한다고 줄지어 서 있다. 그곳에 있던 6개월간 줄지어 선 차들 중에 허름한 픽업 트럭이나 SUV를 한번도 본 적이 없어.",4,2026-02-14T02:06:23Z
WHLTMKvdx-o,UgzHSARL9fVRcSwB2sh4AaABAg,@hungryyy,ㅋㅋ임윤찬이 정재계에서 미운털박혀서 괴롭힘당했다는거 보면 예체능이 얼마나 돈있는자들만 누리는 종목인지 알수있다..,39,2025-12-26T03:34:20Z
WHLTMKvdx-o,UgzgNL7ygK3S25pjT914AaABAg,@정직하자-u9o,"어머~ 연봉이 너무 적네요
1년에 사용되는 발레슈즈 값도 안되겠어요",96,2025-05-08T17:35:41Z
WHLTMKvdx-o,Ugw7OgUQ0ODh3r5UMsZ4AaABAg,@복덩이-fiat,시립교향악단은 더 작아요. 그런데 학교 출강과 (이것도 작음) 거의 개인 레슨비가 있는데 레슨비가 1명에 시간당 십만원이상이다.,3,2026-02-06T21:00:12Z
WHLTMKvdx-o,Ugw2Lur0RmHNFDfMw494AaABAg,@bighole9136,예체능은 일단 부자들 놀이터,3,2026-02-25T16:37:27Z
WHLTMKvdx-o,Ugw_weCwSLbhQmt6uzB4AaABAg,@Jullian-x8k,"너무 심하게 박봉이네요.
18년 베테랑 무용수 연봉이 형편없으니 아주 부자가 아닌 이상 레슨이니 뭐니 알바를 안할수가 없겠네요.
부자라서, 또는 레슨비 많이 받으니까 등등이 박봉을 합리화해서는 안될것 같은데요..
문득, 발레도 육체노동이라 임금이 적은건가 하는 엉뚱한 의심도 드네요. ㅜㅜ",9,2026-01-04T16:27:04Z
WHLTMKvdx-o,UgyTK2qYmS-WyWSCsy14AaABAg,@booja1825,"6살 부터 발레 개인 레슨 시작해서 매년마다 새 작품으로 콩쿨 나가며 발레 무용수 되기까지 얼마를 써야하는지 알면 발레 시작 못한다.
극한직업인데 왜이리 박봉인가? 무용수들은 뼈를 갈고  인생을 건다. 예술가들이 대우 받는 시대가 하루 빨리 오길!",57,2025-12-23T06:10:23Z
WHLTMKvdx-o,UgxDE9XOwLioKJ4ZIYd4AaABAg,@michellechoi7340,눈물과 땀으로 보낸 세월의 댓가가 너무 적다.....,20,2026-01-22T23:30:13Z
vB5hcKrs_KM,Ugzrg3NT3BJg7jMu1fF4AaABAg,@plmoknijb-e2j,어린양이 진짜 귀여워요 충격적인 귀여움 왜냐면 점프할때 귀가 팔락거리기때문 ..🥹🥹,384,2023-12-21T15:41:06Z
vB5hcKrs_KM,UgxMgqTdTFsgAoALV9B4AaABAg,@elite3380,제눈엔 국발이  훨씬 눈호강이 최고던데..,194,2023-12-31T05:18:33Z
vB5hcKrs_KM,UgybHQIY3eMCdNWzK5l4AaABAg,@김오이-r9z,국발 춥고. 유발 따수움ㅋㅋㅋ 국발은 백화점이나 뉴욕스트리트의 겨울느낌. 유발은 미국 2층주택 부잣집. 벽난로에서 칠면조 뜯는 크리스마스넉낌임.,174,2024-12-31T12:36:01Z
vB5hcKrs_KM,UgyoAaJNGkxLvKhmIdt4AaABAg,@진희이-n2g,"두개 다 본 개인적 견해로는 
유니버설은 유초등 아이들한테 
더 어필하는거같아요. 
성인은 국립발레단이 더 맞은듯요~",162,2025-01-01T08:10:31Z
vB5hcKrs_KM,UgxAkBTFUBJu4dJFvrd4AaABAg,@gomnung1178,"국립은 우아하고 유니버셜은 화사한 느낌..
둘 다 몇번 봤는데 저는 국립발레단 쪽이 제일 좋았어요^^",13,2025-12-27T08:25:09Z
vB5hcKrs_KM,Ugw4FcoNIEKBekBwVQJ4AaABAg,@antinitonnyeiseo,유발 넘 좋았어요 특히 댓글에서도 언급된 아기 양들 넘모 기여워ㅠㅡㅠ🩷,8,2026-01-29T05:04:02Z
vB5hcKrs_KM,UgyltSiN7htFYXCP-6l4AaABAg,@FamilyK-Hithere,"와.....

유니버셜...ㄷㄷㄷ",104,2023-12-19T08:49:23Z
vB5hcKrs_KM,UgzQe_fC_zSlgWigIdZ4AaABAg,@midoriarin,"유니버셜 버젼으로 두번이나보았는데 너무 귀엽고 사랑스럽고 아름답고 다했어요ㅜㅜ 
울딸과 같이 두번 다 본건데 딸도 너무 좋아했어요~",4,2026-01-23T16:34:03Z
vB5hcKrs_KM,UgxtXQbZ0vDoMCmuYoh4AaABAg,@별별별-n2h,"세종문화회관 오늘보고왔어요!! 유발~♡

극T우리엄마도 
미소까지 짓고 재밌다고 해주심 
2막은.진짜 시간 순삭.. 
완전깜놀!! 
끝나서 넘 아쉬웠음;;
오케스트라도 진짜 대박!!!👍🏻

눈호강+황홀그자체ㅎㅎ🤍
모셔가길 잘한듯🥹",6,2025-12-23T21:00:59Z
vB5hcKrs_KM,Ugx99TdQiFEumgRMR2J4AaABAg,@emilie9561,저는 마린스키가 취향이라 턱히 사탕요정 안무요 ㅋㅋㅋ 유니버셜 보고 왔는데 정말 너어무 좋았어용❤️🥳,34,2024-12-29T00:36:22Z
vB5hcKrs_KM,UgyEePL3bWVndZrxvux4AaABAg,@sunnygu1783,둘다 봤지만 모두 다 유발이 내 취향 춤도 더 잘추는 듯,20,2025-04-27T08:50:53Z
vB5hcKrs_KM,Ugwx0JmRnahYyPcI8NB4AaABAg,@stella임,둘다 아이들과 봤었는데 집중해서 본건 유니버셜이었어요. 무대가 더 화려해서 그런가 예쁘다고 좋아하더라구요.,0,2026-04-29T10:17:03Z
vB5hcKrs_KM,Ugw81gw_Y42hrnlNRul4AaABAg,@Ari-jn8wc,발레 국발 무대배경 유니버설,21,2024-11-28T14:54:15Z
vB5hcKrs_KM,UgyOxFDW0tIj7KcPs8J4AaABAg,@ooh2257,목각인형 어린무용수 너무 귀엽 ㅎ,1,2025-12-31T07:44:13Z
vB5hcKrs_KM,UgwPHdOHpTtUqbJOqCF4AaABAg,@쨩-j6f,국립발레단 추천 오케스트라 라이브,24,2024-12-16T19:47:39Z
vB5hcKrs_KM,UgzG7SAhMGduc_bb3Bx4AaABAg,@에으잉,국립이 너무 좋음!,7,2025-02-10T01:34:25Z
vB5hcKrs_KM,UgwOYqHvwkZ9uXZcZFF4AaABAg,@권금옥2111M,대단하다❤,4,2025-02-01T09:55:33Z
vB5hcKrs_KM,Ugzz92hMfBtOlBqpo9J4AaABAg,@놀고싶다-m7s,유니버설발레단(Universal Ballet)은 **통일교(현 세계평화통일가정연합)**가 설립하고 후원해 온 예술 단체입니다.-출처 Gemini-,2,2026-03-08T09:56:32Z
vB5hcKrs_KM,UgwKk4Xb344YOz4dczR4AaABAg,@이시아-g4x,잘하시네요 ❤,0,2025-12-03T08:00:39Z
vB5hcKrs_KM,Ugy4jojPao53pRhepit4AaABAg,@watermelon-v9b,전체적인 안무나 의상은 유니버셜이 좋은데 호두까기 만큼은 국립 방식이 좋아요,33,2024-12-24T13:08:51Z
vB5hcKrs_KM,UgypapH1LW2JlA0zCJ94AaABAg,@미숫가루-n2v,유니버셜!!!,8,2025-09-03T14:33:46Z
vB5hcKrs_KM,UgzLd9KI5EHhfPYSRZZ4AaABAg,@박애리-f3u,다예쁘다,2,2025-08-11T14:30:30Z
vB5hcKrs_KM,UgxTYrCrNINLzJEkvW54AaABAg,@piADSG,유니버셜 공연!!,1,2026-01-28T06:37:02Z
vB5hcKrs_KM,UgyU3OdgG8q6lWgBV754AaABAg,@JH-xo7wm,둘 다 보고 싶어요❤,6,2024-06-15T13:10:31Z
vB5hcKrs_KM,Ugz_4mbt4-JsnxCcj654AaABAg,@lotusutol,양 너무 귀엽다 ㅋㅋㅋㅋ,4,2025-04-17T01:56:48Z
vB5hcKrs_KM,UgzvABlkbolwVBVgYvF4AaABAg,@rosie5817,각 나라별 춤은 유니버셜이 훨씬 좋았고.. 나머지는 국발 취향,2,2024-12-30T15:32:27Z
vB5hcKrs_KM,UgwUN_7nrymIrBhkiSp4AaABAg,@권금옥2111M,❤❤,2,2025-02-01T10:02:52Z
vB5hcKrs_KM,UgyYdvZmGzrhXHX7u-x4AaABAg,@신밧드의모험7,유버짱,7,2025-09-16T12:16:54Z
vB5hcKrs_KM,Ugw3Lyr6seQJCluO6hp4AaABAg,@英雄本色周潤發,예전 올레그 비노그라도프단장님 버전 많이 봤었습니다 실제로 리허설도 다 지도하시구요  아직도 살아 계신지 모르겠네요,1,2026-01-04T14:27:55Z
vB5hcKrs_KM,UgzTMo-xS-ny_gdhT-V4AaABAg,@리수마,오케스트라 vs 녹음... 뭐 이길 수가 없죠,4,2025-05-01T12:43:49Z
g6KbFjExoJo,Ugyrt_9e3LXa5WTMgth4AaABAg,@incentersmell,검은옷입으신분은 주체할수없는 덩실덩실한 흥이 느껴짐,14385,2024-12-10T03:42:52Z
g6KbFjExoJo,UgwuUjR7bpL1TSI49pJ4AaABAg,@현수진-b3k,"ㅋㅋㅋㅋㅋ 
검은옷분이 너무 길고 우아하셔서
발렌줄 알았는데
발바닥이 바닥에 철퍼덕 붙어있네요
파란옷분은 발끝까지 긴장되있구요
어쨎든간에 두분 모두 아름다우시네요~~❤",3830,2024-12-26T01:39:42Z
g6KbFjExoJo,UgyUJRVePZdyEp2iG5B4AaABAg,@업텐션뽀이,"그건 모르겠고, 검은옷 팔이랑 손 너무 예쁘게 잘 쓰네. 발란스도 넘 좋음.",7697,2024-12-16T06:54:03Z
g6KbFjExoJo,UgyGyKdzzuK64WrBljx4AaABAg,@숲-in,"전문적인건 하나도 몰겠고  
파란옷분은 나풀나풀 서양 느낌
검은옷분은 너울너울 우리 느낌",537,2024-12-23T14:46:37Z
g6KbFjExoJo,UgygQHGJePz7ZFiGj0t4AaABAg,@tyuifg6339,"발보면 파란옷
전체적으로보면 검은옷이 몸선 춤선이 참 이쁘네요",3104,2024-12-18T11:45:14Z
g6KbFjExoJo,UgzzoR5HgBsxXb5IV7B4AaABAg,@user-qkdqkd,"머리 묶는 거 부터 차이 나잖앜ㅋㅋㅋ
발레 위로 한국무용 아래로",45,2025-02-03T21:00:13Z
g6KbFjExoJo,UgxHrBnigMHz3fkItah4AaABAg,@rabbit7690,파란옷 입으신분이 포인 턴아웃으로도 발레인거 알거같긴 한데 파란옷 입으신분은 정박에 딱딱딱 동작을 하는반면 (+위로 뛰는 점프) 검은옷 입으신 분은 박자가 다음동작전에 한번씩 눌러주고 가서 (+아래로 눌러 뛰는 점프) 한무 느낌이 나네요. 팔 손목 쓰는것도 그렇고..ㅎ 그건 그렇고 두분 다 춤선이 이쁘네용❤,1153,2024-12-19T16:50:01Z
g6KbFjExoJo,UgwKcVLKBX5pRCWG8hF4AaABAg,@lee-zm2xr,발레는 머릴 하늘로 묶고 한국무용은 머릴 밑으로 묶는다!,316,2025-01-05T12:31:38Z
g6KbFjExoJo,Ugyf4oty6wwNfJvvRdl4AaABAg,@ace3247,"발레는 발만 보면 알죠. 발끝 포인., 발끝포인이 오랜시간 익혀야 나와요.
그리고 무게중심 위로 쫙쫙 뻗는 에너지,
파란옷이에요.",1195,2024-12-04T15:45:44Z
g6KbFjExoJo,UgwTOiYrYhkbKr6NXfJ4AaABAg,@i2s7j,발레가 누구고 간에 오른쪽 분 춤선이 너무 수려하네요.. 무게감 있지만 동시에 부드러움이 같이.. 손 끝으로 계속 시선이 가요. ㅋㅋ 대박 왼쪽 분은 통통 튀는 것이 너무 발랄하고 귀여워요.. 최고,254,2025-02-06T16:13:25Z
g6KbFjExoJo,UgxgVfmjpUc-nnlzUoR4AaABAg,@janesohoo4306,좌측분이 발레 같으나 상체 저렇게 쓰면 그냥 현대무용임. 상체는 우측분이 훨씬 발레 같네요.,1347,2024-12-08T11:52:13Z
g6KbFjExoJo,UgzRuWTtuIzN9o391Lp4AaABAg,@귤철이네,파란색옷 입으신분이 초반에 뛰는동작할때 앞발도 같이 차는게 느껴지고 검은색분은 정자세 그대로 점프만 하시는걸 보니 파란색 입으신분이 발레인것같네용,29,2025-10-10T06:29:28Z
g6KbFjExoJo,UgwCpkgmbqg0mAQPRzV4AaABAg,@030-mo3su,"파란옷 발레
발모양 보시면 정갈한 포인 상태
왼쪽푼은 많이 풀리심",1192,2023-12-04T10:40:38Z
g6KbFjExoJo,UgxVbA79m61X8lQPQs14AaABAg,@Clarify-j1t,검은색 옷 입으신분이 숨기려해도 드러나는 손둥굴리기와 감기가ㅋㅋㅋㅋㅋㅋ,59,2025-01-05T07:02:01Z
g6KbFjExoJo,Ugz6olZZbfSgInT1R6t4AaABAg,@dive5376,파란 옷 분이용 발끝이...ㅎㅎㅎ,1562,2023-12-05T22:44:24Z
g6KbFjExoJo,UgzVcRfZ9DpYtBOv_fx4AaABAg,@essu_loveballet,"파란옷이 발레, 검은옷이 한무. 발끝과 골반에 대한 턴아웃 열림이 다르니깐요. 일반인분들이 보시기엔 공연작품 보다보면 검은옷 입으신분이 익숙하게 보이실거 같기도 해요! 두분 다 멋지십니다",80,2024-12-24T04:30:40Z
g6KbFjExoJo,UgwTAeTnf7LlUo3H-894AaABAg,@kirstie764,나는 왜 파란 옷 입은 분이 무거워 보이지.. 검정 옷 입은 분이 발레 같아 보임,1038,2024-12-18T03:03:29Z
g6KbFjExoJo,UgzIV_3FSuT25am9jbt4AaABAg,@airyu6004,"포인 보면 왼쪽, 가볍게 통통사뿐한게 왼쪽이 발레같은데 오른쪽분은 또 상체를 너무 잘쓰심.. 신기하넹",38,2024-12-23T02:59:21Z
g6KbFjExoJo,UgzrJm6zX58RaDZEUXN4AaABAg,@yj김-x6h,"검은 옷이 한국 무용하는 분 이고,
흰 바지 입은 분이 발레 전공자 이십니다.
발을 잘 보세요!^^",16,2024-12-17T14:42:48Z
g6KbFjExoJo,UgwB64tUJuVWuIFeH-p4AaABAg,@suhyuk000,검음옷입은분 춤선이 넘 우아하니 예쁘시다ㅋㅋ,14,2024-12-25T00:20:14Z
g6KbFjExoJo,UgxIE05H0-hwGXuIZVJ4AaABAg,@nmmnmmn3285,뒤에 분 자꾸 눈길이 가네 뭔가 가볍고 자유로워 흥이 느껴지기도 하고 동작이 참 우아하다,46,2024-12-22T06:22:43Z
g6KbFjExoJo,Ugwt1Mq49Lcn1c-8Hnp4AaABAg,@Un.x.00,"검정색 옷 입으신분이 약간 손이 둥글고 약간
덩실덩실 느낌이 있어서 무용과 같고
그 파랑색 입으신분이 약간 딱딱! 맞게 하는거ㅜ보면 그분이 발레과 같네요❤ 저도 15년생 한국무용과 입니다❤",12,2025-05-03T07:49:59Z
g6KbFjExoJo,UgyqKjXj-R7uSnC5rNF4AaABAg,@민설탕-v5m,까막눈인 제눈엔.... 누가 뭔지는 모르겠지만 두분다 너무너무 예쁘고 잘하시네용 어쩜 몸이 저렇게 깃털처럼 가벼울까요 너무 사랑스럽습니다^^❤❤,27,2024-12-18T03:40:44Z
g6KbFjExoJo,UgyF4yvH4LkWD8hcCrt4AaABAg,@soon_301,현대무용도 좋은데 파란옷분의 발레 특유 우아함이 담긴 동작들이 너무 개좋음 ㅠㅜㅜㅜ,20,2025-03-03T11:54:19Z
g6KbFjExoJo,Ugwx0USwHna2f2ashZ94AaABAg,@김현숙-p8j,검정티분이 한국무용 전공자인듯요~약간 나풀거리는 느낌이 한국무용느낌이좀 있는듯ㅋ,24,2024-12-18T04:36:12Z
g6KbFjExoJo,UgzN-LRlKdgbX2ahJF14AaABAg,@puming_k14,발레 특유의 우아함과 한국무용 특유의 우아함이 너무 확고하게 보임ㅋㅋㅋㅋ,0,2026-04-26T09:30:17Z
g6KbFjExoJo,UgwQQbzhO3EfmNLLFvt4AaABAg,@chapamandy4859,춤을 모르는 나는...  전혀  차이를 모르겠슴... 내 눈엔 그냥 두분 다 엄청 잘하심...😅😅😅,51,2024-12-23T21:22:46Z
g6KbFjExoJo,UgxoyyhFl707BbaPchN4AaABAg,@rhkrrbgis,발 포인이 역시 발레하시는 분이 살아있음,4,2026-02-13T13:52:03Z
g6KbFjExoJo,Ugw-EA9RHJbuK_PNM1N4AaABAg,@사람이꽃보다아름다워,상체 보다가 뭐가 다른지 모르겠어서 발을보니 확연하게 다르네~,8,2024-12-19T16:47:46Z
g6KbFjExoJo,UgxjLv02MkqFupARRRd4AaABAg,@hanijeong5215,피지컬은 어쩔수 없나봐여ㅜㅠ❤,2,2025-09-30T12:00:16Z
gHHpHKqiIjc,Ugykg6Kf7D589htD34R4AaABAg,@아멘.JesusGodDamm,중성마녀의 파드되만 보다가 실제 발레리나 발리리노 두 분의 파드되를 보니 정말 아름답군요,92,2022-06-29T14:52:04Z
gHHpHKqiIjc,Ugwvxq6YF4NF9aHfIjt4AaABAg,@호그와트n수생,"의상이
흑조가 아니아 공작새 같다 ㅠ",98,2019-09-16T01:45:08Z
gHHpHKqiIjc,UgxiAu7rJCwdO_4zJ6B4AaABAg,@하리보-g3y,흑조라기엔 웃을때 표정이 되게 천진난만 한거같아요 중간중간 사악한 미소는 함정카드발동된 표정같음 흑조는 유혹적이고 도도한 느낌을 살려야한다고 개인적으로 생각해서 아쉽네요 춤은 진짜 멋져요 흑조장면 좋아하는데 영상 업로드 행복합니다,189,2019-08-31T14:23:57Z
gHHpHKqiIjc,UgwddQywHMqA_zOh5gR4AaABAg,@로로피아노선생님,사람보는 눈은 다 똑같은가보다.  나만 뭔가 부족한가 싶었는데 다들 흑조 연기력에 문제점을 삼네요. 흑조는 팜므파탈과 사악한 표정이 압권인데 너무 방긋방긋 웃고만 있네요 ㅜㅠ,61,2020-01-04T17:17:57Z
gHHpHKqiIjc,Ugxm0ijOdkbEWc-ODXF4AaABAg,@Akdma00,"뒤에 가만히 계시는 발레리나 발레리노들도 대단하신것 같아요.
미동도 없이 같은 자세로 계속 있는거 진짜 힘들겠어요.",55,2019-12-28T15:37:39Z
