video_id,comment_id,author,text,like_count,published_at
X0kYxjjOf1c,Ugxn3Wj2nu3u41QjTPR4AaABAg,@sinsaeveria327,로레알 에르네뜨,1,2023-08-25T09:42:13Z
X0kYxjjOf1c,Ugxl38-R6FQgQT5T4ph4AaABAg,@bixnniee,로레알 가격이랑 어디서 살 수 있는지 알려주세요!,4,2024-08-04T15:29:00Z
X0kYxjjOf1c,UgxegqSAp5hnNER8lBp4AaABAg,@박아름-u2s,"솔직히 물제형 오일 다 의미없음
올영에서 웬만한 헤어제품은 진짜 다 써봤거든요
결론적으로 말씀드리면
크림이 걍 개깡패임다.......
성분이 고농축이 아니다?걍 물에 다 씻겨내려져요~~
내 머리가 진짜 빗자루다 하시는 분들은
실크테인 클리닉 하세요
1번만 해도 모발 개선 지려요....
진짜 왜 30만원씩 미용실에
돈 쳐발랏나 넘 후회중입니다.... ㅠㅠㅠ",21,2024-05-01T11:41:54Z
X0kYxjjOf1c,UgwEv9aSJu9NMEdrkj54AaABAg,@just_D0_it,웰라는 어떤가요? 로레알이랑 비교하자면,3,2024-03-06T03:52:10Z
X0kYxjjOf1c,UgwvJwSz8mOGSrcGaMp4AaABAg,@Zyodchpsylejvkhsyfu,혹시 다 얼마정돈지 아시는 분,1,2024-05-14T12:54:42Z
X0kYxjjOf1c,UgwHwhFd2ndlKzZAU-14AaABAg,@litch_o,숏츠 치고 서론이진짜너무길어요,47,2023-10-12T12:36:14Z
X0kYxjjOf1c,UgwCNFSYXlkLA0hpJ6J4AaABAg,@샤월-q5b,"진짜 본론만 말하자
서론 기네",12,2023-09-09T12:41:40Z
X0kYxjjOf1c,UgzxexQN3uzoQIPmkJN4AaABAg,@-glisten,사람한테 스프레이 뿌려대는 저 아이돌누구에요?,0,2024-05-13T03:56:38Z
X0kYxjjOf1c,UgxNdZTydsH83V5AWnt4AaABAg,@pldb4885,근데 중간에 아이돌 나오는 부분 스프레이 얼굴에 저렇게 뿌리면 위험한거 아닌가요??..,71,2023-03-07T13:23:44Z
X0kYxjjOf1c,Ugw_PWIFyn1s-Ju_IRh4AaABAg,@안녕하세요-y4k7m,스프레이 앞머리말고 웨이브한 머리카락에 써도 상관 없나요?,0,2025-08-21T07:43:52Z
X0kYxjjOf1c,UgxcqybJZNu6uUXIB_x4AaABAg,@디어마이-d3e,로레알 난 떡지고 딱딱해지던뎅,25,2023-04-15T16:36:20Z
X0kYxjjOf1c,UgzduPaMTDbE0IT60bx4AaABAg,@Jerry-uh5ix,굳이 청담동을 강조한 이유가 뭐노 ㅋ,10,2023-09-13T19:34:17Z
X0kYxjjOf1c,Ugx5hNUX5OFOWou9ZJt4AaABAg,@카드값줘체리-i3x,로레알 별론데.. 다신 안쓰고 싶음 고정략 없움,4,2024-08-01T12:53:19Z
X0kYxjjOf1c,Ugz6N_Ayk1zft8SqKNJ4AaABAg,@rrrrrr166,"아모스 빼고 냄새 전부다 별로에요

강한고정 원하면서 착한성분 착한향
폴미첼

성분은 잘모르겠지만 강한고정과 폴미첼향달달구리향 원하면 미엘 물스프레이

가스스프레이 약한고정력 영상에 나온 아모스 “디자이닝” 스프레이

싸고 달달하고 강한고정력

팜파스 물스프레이

저 영상 나온 제품 다 2000년대 초반제품 ㅋㅋㅋ 좀더 업그레이드 하시지
향좋고 질좋은거 엄청 많은데 ㅋㅋ",9,2024-02-19T14:33:52Z
WQ1FVPQZmWQ,UgzqAnIPc7sU77JKmSt4AaABAg,@진-p2j,민생차원에서 이런사기광고 뭐 스폰서 하면서 무슨 치료제개발 이런놈들 찾아내어 날려버려야 한다,20,2025-06-28T10:00:57Z
WQ1FVPQZmWQ,UgxmaXz26MJ9wUND1px4AaABAg,@와우-0,이따위로 뿌리면 온사방 더 뿌엿게 떡칠됨..뿌린자리만 반짝 주변은? 가루날림으로 다 번짐..,36,2025-03-05T11:14:42Z
WQ1FVPQZmWQ,UgykauiZid_bGT4y3x94AaABAg,@seulgi_love,도색이 문제가 아니라 찢어졌잖아 ㅋㅋㅋㅋㅋ,2,2025-10-08T09:01:22Z
WQ1FVPQZmWQ,UgxOjmg8iM3TagyQspB4AaABAg,@순나박-w4z,제품 어디서 살수있어 요?,0,2025-06-20T03:21:39Z
WQ1FVPQZmWQ,UgwvS0-rhaUaNUwpWJp4AaABAg,@진동일-h1m,회사 연락처 알려주세요,0,2025-08-16T23:20:57Z
WQ1FVPQZmWQ,UgxGf1TgazFCHbHAZxB4AaABAg,@여기있었구만심영-i4b,"저런거 세상에 진짜 있으면 도장회사 다 망하고
발명한사람은 노벨상임 무조건
거의 탈모 노벨 받는 수준의 그런거임",1,2025-10-13T09:57:41Z
WQ1FVPQZmWQ,UgzYkE5OF6uAPRn3IYV4AaABAg,@user-fv1qr6pw7i,CG 잘하네요,0,2025-07-24T05:37:45Z
WQ1FVPQZmWQ,UgyLy-9F27yaSR6brYN4AaABAg,@hyoshiklee5242,낚이는 인간들이 순진한 거지,11,2025-04-09T19:45:10Z
WQ1FVPQZmWQ,Ugx2egD8EfCaHKASH054AaABAg,@백마탄환자-u6m,절대 저리안됨...퍼티도 없이 베이스 만으로 단차를 메꾼다고? ㅋㅋㅋ,4,2025-02-20T14:10:14Z
WQ1FVPQZmWQ,UgzRZDtBRYvXzVegi3Z4AaABAg,@loscak,가짜임  실제로  제품하고  너무차이나고   그냥 물광택제임  절대  낚이지 마시길,4,2025-03-29T06:53:34Z
WQ1FVPQZmWQ,Ugx-vDXRAaXN4QBkALx4AaABAg,@지호모터스,중국은 자동차가 찌그러지는게 아닌 찢어집니까?,0,2026-02-16T08:29:37Z
WQ1FVPQZmWQ,UgxbEUcUiSn3TX61E_F4AaABAg,@김세연-u2w,판매사이트가르쳐주세요,3,2025-02-23T04:32:36Z
WQ1FVPQZmWQ,UgxdghhGA9UoPvGK7Mh4AaABAg,@덕캠프,채팅글 안봤으면 구매할뻔했네...,4,2025-08-07T13:40:24Z
WQ1FVPQZmWQ,UgyeG5pqvMXe25oTmjx4AaABAg,@앤써니-h5u,보양도 안하고 저렇게 도색을 한다구요? ㅋ,0,2025-09-28T23:09:36Z
WQ1FVPQZmWQ,UgxBNg1JXe-9yWziR8x4AaABAg,@Bab_4줘,유리는 어떡함??,5,2025-03-03T23:06:33Z
WQ1FVPQZmWQ,UgzZZBXkcqUrY1ETxfh4AaABAg,@구닭다리-x3p,빠데 퍼티 마킹 작업 안허고 저게 된다고? ㅋㅋㅋㅋㅋㅋㅋㅋㅋㅋㅋㅋ,1,2025-06-18T09:32:40Z
WQ1FVPQZmWQ,UgxhLTZM1DYZnVwMNqp4AaABAg,@제인-c1y,어서  팔아유?,1,2024-11-05T04:02:13Z
WQ1FVPQZmWQ,UgwnH9LJbKwDnHik25B4AaABAg,@kjhyoung79,공업사에맡기어야나오징.저것 과대광고임.저것은중국스럽음,2,2025-06-06T03:54:25Z
WQ1FVPQZmWQ,Ugzi7I8leIuUgbeSXMt4AaABAg,@산속별장에서,잘못뿌리면 젖되요,1,2025-06-14T12:34:18Z
WQ1FVPQZmWQ,UgyMlU13spJ6qWwcsbB4AaABAg,@정부럭-l8k,뿌릴때만 화면이 일그러지는거같은데 착각인가,0,2025-08-17T11:13:46Z
WQ1FVPQZmWQ,UgwhGmdReAfUBrPuMlx4AaABAg,@사리사욕-t7u,저건마법입니다,1,2025-04-30T09:05:55Z
WQ1FVPQZmWQ,UgzSgKvC5nnYdPuhOVh4AaABAg,@Alive연두,내가 지금 도장에서 일하는데 ㅋㅋㅋㅋ이건 그냥 과대 광고 ㅋㅋㅋ,27,2025-05-06T17:08:02Z
WQ1FVPQZmWQ,UgyMcLxrJRM8p3Ycdt54AaABAg,@YoteamoLOVE1,"어따 사기를 치노
확그냥 막그냥",4,2025-04-01T13:44:35Z
WQ1FVPQZmWQ,UgwAiREb4Q0nOLU5RGZ4AaABAg,@배용준-d9q,"뿌렸는데 더 지저분해짐😢😢
붙이는것 추천",2,2025-03-09T12:56:53Z
WQ1FVPQZmWQ,UgxC4f9crZUGgaRXO2B4AaABAg,@파란G9,허위광고입니다,0,2025-10-29T03:15:22Z
WQ1FVPQZmWQ,UgxA4DItgzBP7kJ7h_94AaABAg,@스팀샷,"거짓말임, 현혹되지 마세요",58,2025-03-01T05:48:43Z
WQ1FVPQZmWQ,UgwPngtM1dwhX-xAz3l4AaABAg,@김형주-k5w,"적당히 뻥을 쳐야 ㅋ
마르고 나면 다 들뜨고 난리 나것네요",4,2025-03-30T17:24:01Z
WQ1FVPQZmWQ,UgyHAIQM_KaZQt3z9fF4AaABAg,@ete두리,속지마세요....저도 알고싶지않았어요,0,2025-11-28T09:59:28Z
WQ1FVPQZmWQ,UgzADcAPk70N0qsEj8N4AaABAg,@슈퍼신동,사기네 ㅋㅋㅋ,0,2025-08-22T14:25:08Z
WQ1FVPQZmWQ,UgzhScr3QIJduRsnnLx4AaABAg,@sj0583,장난하냐 ㅋㅋㅋㅋㅋㅋㅋㅋㅋ,0,2025-06-22T07:18:16Z
E_ehiIfnLjs,UgxRvgZFgBOJlj08Eqt4AaABAg,@annscott-j3p,"Spray sunscreen is chosen because it doesn't stay on the skin like a cream, and it's easier to apply!",61,2025-12-10T00:15:54Z
E_ehiIfnLjs,Ugx9Be1YjFqplM7YpgR4AaABAg,@Soma_3103,I also agree with this... ❤,17,2023-11-29T17:42:03Z
E_ehiIfnLjs,UgxUN1hqq4CfD4PGFQl4AaABAg,@mommynmum,Yes you are right! That's why not all sunscreen sprays require rubbing like the ones from Wishcare and Bubble Me.,10,2025-06-19T04:28:24Z
E_ehiIfnLjs,UgzWzRU7RznV7SMe3jZ4AaABAg,@farahdibasonda6708,Exactly!,6,2023-11-29T01:58:30Z
E_ehiIfnLjs,UgwRhhbBjTaZISBN6Ud4AaABAg,@Jannat_vasa,Apu kon page theke niyechen,1,2026-06-14T09:20:39Z
E_ehiIfnLjs,UgxUmFNJcAgQRNjEktd4AaABAg,@rajeshrakeshhota3243,"Open windows and doors then use. Used outdoor, aerosol not safe",6,2025-02-16T02:18:48Z
E_ehiIfnLjs,Ugy00TdvbivF1gtuoaB4AaABAg,@icebear2380,Apu amk dermalogist sunlocj spf 50 spray suggest koreche.ami ki sunlock spf 50 cream version use korle hbe?,0,2026-03-09T17:49:55Z
E_ehiIfnLjs,UgwOzer_OEIDJPXqe4V4AaABAg,@aditeeisahuman,"I also have same sunscreen but la roche posay xl , and it comes out like liquid and not like spray like u have, what should i do? Are they both different?",0,2026-06-09T08:23:01Z
E_ehiIfnLjs,UgzcACln7gguKQcrI0t4AaABAg,@rafasarkar3609,Apu plz review raylock sunscreen,0,2026-05-12T17:00:27Z
E_ehiIfnLjs,UgzIbMLwnA25SwLbUjJ4AaABAg,@Nusratoma,Do you think stick sunscreens are good for reapplication??  Like the ahc / inisfree one,8,2023-11-28T19:34:22Z
E_ehiIfnLjs,UgzipVVwyx17KgYjEaV4AaABAg,@rocketeer5169,Can you be more clear... are u suggesting to buy it or not to buy it?,2,2026-06-08T10:12:08Z
UT0ahR960gs,Ugx5BiFcTUcPEuL6H1t4AaABAg,@TheOBr0z,I use sea salt spray on my straight hair and it makes it look wavy and curly,694,2024-11-17T04:38:06Z
UT0ahR960gs,Ugx6Ea2iZMv6n5kw8uR4AaABAg,@not_m,SEA SALT! I NEED YOU SEA SALT 🗣🗣,179,2025-03-31T12:51:53Z
UT0ahR960gs,Ugz7PYCs5Rc2ljqYZy14AaABAg,@Crls-cv2di,Dillon: I approve this message,150,2024-10-10T00:46:57Z
UT0ahR960gs,UgzbKlAUA71u58SDYKJ4AaABAg,@Ping1-y1k,I use both at the same time im using it rn😊,203,2024-09-01T10:46:07Z
UT0ahR960gs,UgwgEHMWQSlJPxuGVBt4AaABAg,@purushottamthapa9615,Thacks bro that tusher poder helped me out,26,2024-12-18T22:48:19Z
UT0ahR960gs,UgzJrmDNCVm93T7AtE94AaABAg,@Gdoge508,I don’t get why these people say it’s oily it’s not it actually makes your hair look good,26,2025-02-27T00:06:42Z
UT0ahR960gs,UgzbWY9W_3L35IodF9l4AaABAg,@steveoku7047,Personally i like to use powerplex spray,42,2025-04-03T23:00:30Z
UT0ahR960gs,UgwmH4Yw7kUKUQNh24J4AaABAg,@AverageAsian11,I have thick straight hair and sea salt spray doesn’t do shit but texture powder does more,10,2025-11-11T03:48:14Z
UT0ahR960gs,Ugy8T4TwEJmFOTz0ISR4AaABAg,@rndx35,Yeah it's perfect for me! My hair is super thick with some slight curls. Texture powder has lots of hold but the volume makes my head look really big. The sea salt spray gives that texture but without the insane volume.,0,2026-03-28T12:37:46Z
UT0ahR960gs,Ugwf0hvV8BxJvthfet94AaABAg,@that1kid6.9,lance please make a video on the texture powder and the difference it makes,7,2024-09-02T05:21:24Z
UT0ahR960gs,UgyLCEeonDKjfE0WiNh4AaABAg,@RevolutionarilyOrdinary,"What if you have straight flat hair but it doesn't get oily easily, and it really dry?",3,2026-03-26T09:08:51Z
UT0ahR960gs,UgwToydqP0CIeRaPGMV4AaABAg,@AK_PLAYSGAMES,can u make the bottle a sifter instead of the spray pump,1,2026-06-01T02:46:59Z
UT0ahR960gs,Ugweil4dsX2ODPnAq5x4AaABAg,@DarwinLopez-y8q,Yess finally a based sea salt spray to use straight thick hair 😎👍,0,2026-04-04T19:31:31Z
UT0ahR960gs,Ugx5k64NA7Bqbs2ayth4AaABAg,@Ohtani-k7h,What is the difference between beef tallow and the face wash combo,1,2026-06-18T20:28:17Z
UT0ahR960gs,UgwwOeiJb4eEM2Uvz-x4AaABAg,@Drewdawg_15,Just bought texture powder it’s so good,0,2025-02-22T17:50:22Z
UT0ahR960gs,UgzsYHcYAA92p5-Y_kN4AaABAg,@Renxez,"can i use both at the same time? , and do u apply the texture powder when your hair is dried? or can i apply it right away i put the sea salt spray?",2,2025-03-14T02:21:41Z
UT0ahR960gs,Ugzt3mQedrfKk5-ytTt4AaABAg,@Juddsicle_NPC,U guys should make cologne,0,2025-10-13T15:13:14Z
UT0ahR960gs,UgxZx0R0us73XLIGJwl4AaABAg,@crocsonsportmode-y5p,what if I have thin straight hair that isn’t oily at all,3,2025-12-29T00:54:50Z
UT0ahR960gs,UgzozOZu5rnC28kmUMF4AaABAg,@BenicioMarin-e6b,Thanks!,0,2024-09-06T03:58:42Z
UT0ahR960gs,UgxcGY8tUT5xGYwpxHF4AaABAg,@MONAZ_Editz7,"My hair is wavy so which product I use ?
This two 
Tell me please",1,2026-01-03T12:32:47Z
UT0ahR960gs,Ugwh8-tTeoUE1YLCHnt4AaABAg,@Tacoisgud,Im surprised he didn’t glaze his own product,2,2024-12-14T14:01:45Z
UT0ahR960gs,UgxO2jwFSIhcjVSpryB4AaABAg,@DannyZebhi,Why can the based products not be in supermarkets,2,2026-01-01T11:39:50Z
UT0ahR960gs,UgzbxCyX5P1IgiuW9KB4AaABAg,@Kappa412-h3g,I have thick straight hair but the powder is better for me,0,2025-07-16T04:43:11Z
UT0ahR960gs,UgwcGWOE6BUHVEpxemZ4AaABAg,@typeshiii-4u,Yo I got a question does my hair also get fluffy with the sea salt spray?,1,2025-03-27T15:40:09Z
UT0ahR960gs,UgwQQJqErT86FZWozuZ4AaABAg,@g.o.dgaming5096,Pls bring your products to india?,0,2025-08-06T16:51:31Z
UT0ahR960gs,Ugw34GDxTW0op5zhW-t4AaABAg,@Monkey_Man687,I bought clay and the sea salt spray so I can have good hold with the spray,0,2024-11-16T02:58:26Z
UT0ahR960gs,UgzgTV9tFGHtqmNsD0x4AaABAg,@immanuellalthlenglien1007,Can we use both,2,2025-05-11T14:28:40Z
UT0ahR960gs,UgzRMhzPxHZ_5jhEkCF4AaABAg,@itccindy118,Well does sea salt spray work for curly perms,0,2025-09-16T20:15:10Z
UT0ahR960gs,UgwtYq_qeFIZ3mmmvn54AaABAg,@PackedIce0,I used ur guys texture powder It didnt do what u advertised and it made my hair feel weird 😢,1,2025-05-16T02:21:11Z
UT0ahR960gs,UgyAMk4AwmJuY24fqH14AaABAg,@ChristianMadison-b3d8z,Can you show me but it will look like if you use sea salt spray to make your hair have more volume and use the texture powder to make it wavy and see the results,1,2025-07-27T01:48:09Z
C5nEddGmIDs,UgwBrSQFJL8-2QFlTpF4AaABAg,@tool-Jay,"▼▼ 제품구매 가능한 링크입니다 ▼▼
1. https://mkt.shopping.naver.com/link/6852b8a1147acf255e8dfc04
2. https://mkt.shopping.naver.com/link/6852b8a0501108490cdcb33d
3. https://mkt.shopping.naver.com/link/6852b8a02b4ab36a9ced556c
1. HPT 마끼다호환 스프레이건(MA20-HSG110) : 네이버 구매
2. HPT 스프레이건(MA20-HSG110) + 4Ah 배터리 + 고속충전기
3. HPT 스프레이건(MA20-HSG110) + 2Ah 배터리 + 고속충전기

""이 포스팅은 쿠팡 파트너스 활동의 일환으로, 이에 따른 일정액의 수수료를 제공받습니다. 
HPT 디월트호환 스프레이건 (DW20-HSG110) : 쿠팡 구매
https://link.coupang.com/a/czXzIO
HPT 5Ah 배터리 C타입 충전가능 (DW20-TC150) : 네이버 구매
https://mkt.shopping.naver.com/link/6...

주피터 마끼다호환 스프레이건(JSP-20P) : 쿠팡 구매
https://link.coupang.com/a/czXs4V
주피터 디월트호환 스프레이건(JSP-20P-DE) : 쿠팡 구매
https://link.coupang.com/a/czXxas
주피터 보쉬호환 스프레이건 (JSP-20P-BO) : 쿠팡 구매
https://link.coupang.com/a/czXxLw
주피터 밀워키호환 스프레이건 (JSP-20P-MI) : 쿠팡 구매
https://link.coupang.com/a/czXyf9",0,2025-08-11T11:42:34Z
C5nEddGmIDs,UgxmZvRPlxhlygGyCx94AaABAg,@hanyhanybass8546,"주피터 제품 브러시리스모터라고 소개해주셨는데 영상보고 구매했습니다 구멍안 모터쪽에서 스파크 팡팡 튀는 일반모터가 들어있습니다.
상품정보에도 브러시리스모터라고 하는데 실 제품은 다르군요",1,2026-04-20T09:01:17Z
C5nEddGmIDs,UgzB3Fk2XkAnfn1_ub54AaABAg,@chomr9883,참 자세히 리뷰해주시네요 대단하세요🎉🎉,2,2025-09-18T06:22:31Z
C5nEddGmIDs,UgwwX3R16b1OJyag7rZ4AaABAg,@피쉬피겨,굿 리뷰 감사합니다!😊,1,2025-10-01T12:25:49Z
C5nEddGmIDs,UgxvccOVOzvL4LjkrIJ4AaABAg,@kkw9090,좋은 영상 감사합니다 !!😊,1,2025-07-19T16:44:11Z
C5nEddGmIDs,UgwnYocwNhE7s9Elw8B4AaABAg,@kisuho,자세한 설명과 비교 테스트 잘 봤어요 👍,1,2025-08-08T10:48:51Z
C5nEddGmIDs,Ugx59t5OxbleOxFSG8p4AaABAg,@jonghyunpark2498,유용한 영상이네요~!,1,2025-06-26T13:25:02Z
C5nEddGmIDs,UgzlhISJWgSsXU7GXbR4AaABAg,@spacelayback8625,"영상이 깔끔하네요.
공구제이~",3,2025-06-18T14:52:57Z
C5nEddGmIDs,UgzNqF43Vyk5szBDRuV4AaABAg,@인머니,공구제이님의 비교 리뷰 감사합니다.,2,2025-07-04T09:10:27Z
C5nEddGmIDs,UgyBseHilzzph_43sDZ4AaABAg,@spacelayback8625,하나 쟁여두고 싶은 가격대네요😮,1,2025-07-04T06:49:59Z
C5nEddGmIDs,Ugz1iiViJWUZRaFfg154AaABAg,@맛있는도토리,미남이세요^^,2,2025-06-19T12:41:37Z
C5nEddGmIDs,UgznLxJ-D_2pkrvkWPB4AaABAg,@C-3PO_9988,"자세한 리뷰 감사합니다.가격이 생각보다 더 저렴하게 나왔네요

다만 HPT 저 배터리(MA20 TC150)는 개인적으로 매우 비추
C타입이라 별도의 DC 충전기가 필요없이 USB 충전기로 충전 가능한점은 편리합니다만

전 별다른 이유도없이 넉달동안 3번 고장났네요
그라인더같은 고부하작업을 장시간 한것도 아니고
충전기를 이상한거 쓴것도 아닌데 어느날 갑자기 충전이 안되더군요
AS는 잘해줍니다만 배터리는 구매후 꼴랑 6개월 보증이고
수리가 아닌 새제품 교환
게다가 배송비는 반반 부담입니다.(배송비로 만오천원 지불했네요)
교환이니 수리센터는 고장원인도 알지도 못하고
그냥 6개월만 바꿔준다는거네요
저만 문제가 있는것도 아니고 다른분들도 그러는거 같구요
정품에 비하면 싸다지만 가격도 그리 싼것도 아니고요
그냥 DC타입이 고장이 덜나고 가격도 더 쌉니다
차라리 그걸 사세요",2,2025-07-15T02:04:31Z
C5nEddGmIDs,Ugz-zeqC-3DCUbro8V54AaABAg,@이런젠장-m2x,"두개다 사용중입니다.
주피터를 수성용으로
hpt는 유성용으로 사용 합니다.
희석해서요.
즈피터 제일 큰노즐
hpt는 노즐 구경이 너무 좁아요.",1,2026-03-14T12:27:56Z
C5nEddGmIDs,UgzqPj5LbL5TaBO3Wqp4AaABAg,@WORKERSJEJU,유성 페이트 사용도 가능한가요?,1,2025-07-30T04:07:25Z
C5nEddGmIDs,UgyPGSmcMnFsMn6YY_14AaABAg,@방쌤-z1l,"페인트가 묽어야되나요?
분사가 되질 않아요ᆢ",0,2025-11-22T23:43:01Z
C5nEddGmIDs,UgyY-32wpni-0unDd194AaABAg,@jmpark6620,둘다 출시한게 단점,1,2025-07-17T12:31:05Z
C5nEddGmIDs,UgwJiOnSZDFEsF7CNyV4AaABAg,@안줄려나졸리-u9n,영상에 사용하신 hpt베터리가 궁금한데요  두기계에 모두 호환이 가능하군요,0,2025-08-27T08:56:34Z
jYcdq5vxXtk,UgxLo0pwO8Daxnrt1iR4AaABAg,@my6btc,Ok now try it with green paint,6,2026-04-15T04:29:03Z
jYcdq5vxXtk,UgxRkzttWApphCQfVpx4AaABAg,@marcos061059,Perfect fan pattern.  Only spray painters appreciate this.,4,2025-11-19T19:53:08Z
jYcdq5vxXtk,Ugzi9BAII8xzc3VlgGt4AaABAg,@AJsHotRodsNrepairs,"Careful spraying with a gun that is centre wet like that. I'm guessing that just be a budget gun or something cause I don't recognise it, but anyways when you start and it gives you a center dot like that, that then grows into the pattern that's not what you want, there's a high chance that can give you runs out Tigger striping, modeling, ripples, and even dry edges. When you pull the fluid all the way in your pattern should be flat I or O pattern instantly. What you got there is potential for disaster",8,2026-05-07T13:00:55Z
jYcdq5vxXtk,Ugx4YPtTSuVjXg3w9rN4AaABAg,@Dragon-x7i7t,Факел 👍,2,2025-10-29T16:07:13Z
jYcdq5vxXtk,Ugw-K5EljMA_4EtxQIR4AaABAg,@lyndon1961,That what i call dialed in.,0,2026-06-12T03:00:16Z
jYcdq5vxXtk,UgweR_AJqqhPpqzsFjR4AaABAg,@carlosgirao1106,Top,1,2025-09-25T08:35:28Z
jYcdq5vxXtk,UgzwOb4YrYwjGMJ0K1F4AaABAg,@filippof3239,Che pistola è?,2,2025-10-07T10:34:14Z
jYcdq5vxXtk,Ugw11l-zunNSjWpbKBF4AaABAg,@alexsharapov6520,Красивое,0,2025-11-13T19:08:35Z
jYcdq5vxXtk,Ugy_kfUNeSsIfXxoM5R4AaABAg,@matiusteddyc.856,Where to buy?,1,2026-02-14T18:58:44Z
jYcdq5vxXtk,UgyRop5eZ13Jo56aaM14AaABAg,@mrsmitt00,Какой это пистолет?,1,2025-10-30T05:08:39Z
jYcdq5vxXtk,UgwXubB5ZuRp-f7EyVZ4AaABAg,@mod6153,Sata jet 5000 hvlp 👍,0,2026-01-14T13:32:08Z
jYcdq5vxXtk,Ugx7AKsv7alM26DiF1t4AaABAg,@Руслан-ч7н6п,"Я купил один из самых дешёвых краскопультов, факел такой же",2,2025-10-29T18:23:11Z
jYcdq5vxXtk,UgxG0_Ccum3qlVnsuZ94AaABAg,@thomasshelby4809,1.3 ???,0,2026-03-25T18:39:37Z
jYcdq5vxXtk,UgyQUAYNpIl6uYnog3x4AaABAg,@4UMAX,У всех дешёвые краска пульты ?,0,2025-11-02T21:07:59Z
jYcdq5vxXtk,Ugwcp76FL8JUpfGmtLZ4AaABAg,@Jgvyfurfvhdcv,И шоо это 🥴🤔фак фак факел ???вродебы с первого раза понятно што укрывисто льёт ✌️👍,1,2026-01-22T17:12:06Z
jYcdq5vxXtk,UgyN5brtBtM-v33piCh4AaABAg,@JesusmanuelPalomares,😂,1,2025-11-28T22:31:13Z
jYcdq5vxXtk,UgwW91RToe4AeG_h3_l4AaABAg,@unapologetic7900,"Title says ""LVLP"", but the description says ""HVLP""... what gives here?",0,2026-06-09T04:50:32Z
Tj4h-xy7CNw,UgxUmdbxJF-wbXk1tG94AaABAg,@krisbrand354,"Max I bought the corded version after watching your clips on this gun. Whole sprayed, doors, big skirts, arcs, picture rail in a big old house, maybe bit over an hour. Unreal. Primer had it set on about 6 or 7, aqua enamel turned it right down to about 4. Worth every cent.",15,2022-11-16T06:05:09Z
Tj4h-xy7CNw,Ugz75bRa5sBOA4gKuM54AaABAg,@Jimmy_Cavallo,"🚨 why do people put up product review videos like this, but not indicate the brand of the product.??  WTH",30,2025-03-02T07:45:25Z
Tj4h-xy7CNw,UgxuU6o6ibDqBnLKtqN4AaABAg,@GodBlessedAmerica,Nice a quiet. Nice spray pattern too.,2,2024-06-18T23:34:20Z
Tj4h-xy7CNw,UgySns32f7Uvqyryixt4AaABAg,@transformthishouse,Super video 👍👍👍👍,0,2022-11-14T07:52:45Z
Tj4h-xy7CNw,UgzJhdH9YfZGR-FZ9i14AaABAg,@dustinmontoya6124,"I’d gladly go with the new side shot over the hand held. I’ve had mine for awhile and honestly it’s more of a headache than not, but when it works, it’s great. Just a poor design for the price point. I basically use Graco exclusively but I’ve dabbled with Titan and idk, this specific machine just never sold me. Gonna try less popular name models and just see how they do and turn n burn!",0,2025-08-16T18:55:10Z
Tj4h-xy7CNw,Ugx5FYIMNeucGPOi9RV4AaABAg,@Sunflower_2018-o3b,Brand please! And model?,1,2026-02-09T23:31:09Z
Tj4h-xy7CNw,UgwTf3FAuf6eIit_tMt4AaABAg,@Soulrider4631,Buying link,0,2025-03-17T12:29:30Z
Tj4h-xy7CNw,UgwyLcBQRTIrm4Ho-0l4AaABAg,@arindiy,How much.? When in indonesia product.?,0,2026-04-21T03:21:48Z
Tj4h-xy7CNw,UgyAX2whUqb5HKIdu914AaABAg,@tim62744,For small jobs only pumps fail quick,6,2023-09-09T19:33:10Z
Tj4h-xy7CNw,Ugx1PFKxh_4xdt7jRj94AaABAg,@HieuTran-iy3ui,Does the sprayer left the texture like people skin when it is dry ?or it left a smooth finish like the big paint sprayer?,4,2023-05-28T05:36:30Z
Tj4h-xy7CNw,Ugze9T9hJgul4sc2aB14AaABAg,@dmarr528,Something like that is good for closets ONLY!,2,2022-12-17T12:21:43Z
Tj4h-xy7CNw,UgzfOqYCj3ZB1GO0Qsx4AaABAg,@bolakaleshorun,Good machine. How do get thus,3,2024-12-11T00:12:11Z
Tj4h-xy7CNw,Ugz1YdVeZ8czms4bvEd4AaABAg,@sabitadhanraj290,Hi was wondering where can i get one of that to purchase please,1,2025-09-11T16:12:58Z
Tj4h-xy7CNw,Ugwryr2nnGNyKvPtNsp4AaABAg,@JackieZamDesign,"All of us in the paint industry know it's a Graco Cordless. But my recommendation is not to buy it. It's very nice when new, but after the third use, you have to deaerate the  paint bottle every minute you spray, and it absorbs the paint. This is quite frustrating since it takes too much time to repeat the process so many times to be able to continue painting. I have two of these, I paid $650, and I have them for sale on Marketplace because they're no good to me.",2,2025-09-08T14:56:08Z
Tj4h-xy7CNw,UgyFWqTg_LHUYEbFqJ94AaABAg,@lillulu4498,Do you recommend using them for painting living room and two bedroom,1,2026-05-29T18:49:50Z
Tj4h-xy7CNw,Ugw-x7PKMukKRoeNPlx4AaABAg,@brandongranados5569,Is this faster than painting with a roller ?,1,2023-11-21T18:39:07Z
Tj4h-xy7CNw,UgwDbxQ3yYP6qn76AAR4AaABAg,@sonwasup,Only use for small jobs or the pump will go,0,2025-10-07T23:00:17Z
Tj4h-xy7CNw,UgzirsDuKStaCa-Ey2R4AaABAg,@howyoulikethat4101,its paint or wall putty ?,0,2026-06-07T22:44:45Z
Tj4h-xy7CNw,Ugzqe27btAwaZmNCplx4AaABAg,@garethdavies7564,what people dont tell you ones the pump go's its £150 for new pump 🤦🏻‍♂️😱😱,0,2022-11-16T17:17:45Z
Tj4h-xy7CNw,UgwlNipLY3Cjg1metLN4AaABAg,@Joejoe-tv3hm,That sprayer does small jobs you cannot do whole room or Burn out the motor,0,2022-11-19T23:18:22Z
Tj4h-xy7CNw,UgwrliI6WyjdleY8eQZ4AaABAg,@gzus1482,"Alright, even if you were just using it as a cut in, that thing was made for doors and small jobs as such. 🤦‍♂️ Why not just bring out the airless and get it over with instead of playing games with these toys.",2,2023-01-04T07:19:22Z
Tj4h-xy7CNw,UgymObj52GKzSad-x3d4AaABAg,@awwbeans,Need to wear a respirator. A dust mask is not a respirator!,0,2026-02-01T05:21:02Z
Tj4h-xy7CNw,UgyQWmYwaR4OnfJOq994AaABAg,@kcliverecording,"This guy has no spray experience.  That's just comical.  For trim, and cleaned EXTREMELY well.  Sure.  The rotex pump assembly is $250 ish.  So more than 30 gallons, expect a rebuild.",2,2022-12-16T01:48:00Z
Tj4h-xy7CNw,UgwVmT9zb5IcI-H-sbt4AaABAg,@nickdibiase123,This is not what the battery gun is for its for small projects like doors and what not if your going to spray walls or ceilings you need a actual spray machine like a 390 or 440 depending on size of job,0,2026-03-21T22:48:15Z
Tj4h-xy7CNw,Ugww7h1cHzbacefPjCZ4AaABAg,@dreamingcode,I wish you two would take this down to absolutely useless video if you're not going to indicate what product it is,1,2025-05-18T23:11:43Z
Tj4h-xy7CNw,UgwRe-Xh1TI2St5llnh4AaABAg,@Slightyblack,"I wouldn't recommend this sprayer. I spend more time fixing things on it than anything. When I first used it, it was excellent - over a period of time tho it's always let me down.",1,2026-02-07T18:46:43Z
Tj4h-xy7CNw,UgxfeuW01rTF7yysxm14AaABAg,@sherminmehmedov9931,"This is the worst spray gun ever, i used two time by 10 -15 min with water base paint and it is blocket, the pump is gone in my secound use,  i replaced the pump which is cost me around £200 and again after i used 3 times it is stopet spraying!!!",1,2025-10-20T13:16:33Z
Tj4h-xy7CNw,UgwuThzdTBGh-t_LlRt4AaABAg,@brandonlandis976,Save your money. These have problems. They are coming out with another,1,2022-12-17T00:44:00Z
Tj4h-xy7CNw,UgzLC17L5EftV5H5hZN4AaABAg,@RickClark-t4o,"Terrible, not practical.",0,2026-04-11T17:30:29Z
5xIhmdRv4qo,Ugzs7WQ2x-7QaXX84pJ4AaABAg,@spraywork,"You can buy this gun here !
https://www.amazon.com/shop/amedeo/list/2PKZRNY4KOLHC?ref_=aipsflist",35,2025-04-12T20:44:50Z
